news_id,url,pub_date,title,selected_crawler,accident_date,content
CBMi3gFBVV95cUxQei0tclYxU2s4Q0RlTE1fNGN5NDlSa0NTeVZQQ2RrQkVNeXRYaFVrVV9Sb182em9HQXVDelVBeW40ZjdGcFZXSkpId28wOUk1VHhNWklhUkJzeE4xWGxYWG8wajBRTFJuNG1Feko0cHBPUHNNZDhUZ2FOYzBLdjJRWDVRRGZXUmxZZG9qVl9rNmFxZ0N2WlRWR1g1dDNBN1Y1a2tFaDgzWjNJZFJaclR3QXFZZGJxRDZkTklzTmRsX1BWN3NFeWVtaHpDa0RaMVV3T0l4QmQzS2RXazItTFE,https://www.facebook.com/accidentnews247/posts/los-angeles-ca-pedestrian-killed-in-train-accident-near-media-center-drive-in-gl/1246253801023182/,2026-03-12 22:18:41,"Los Angeles, CA – Pedestrian Killed in Train Accident near Media Center Drive in Glassell ParkAccording to the Los Angeles Fire Department, the incident was reported at around 11:30 a.m. March 11, in the area of 2705 Media Center Drive west of San Ferna - facebook.com",np_html,2026-03-11 11:30:00,"Los Angeles, CA – Pedestrian Killed in Train Accident near Media Center Drive in Glassell ParkAccording to the Los Angeles Fire Department, the incident was reported at around 11:30 a.m. March 11, in the area of 2705 Media Center Drive west of San Fernando Road

Los Angeles, CA – Authorities responded to an accident in which a pedestrian was hit and killed by a train in the Glassell Park neighborhood of Los Angeles on Wednesday morning.

According to the Los Angeles Fire Department, the incident was reported at around 11:30 a.m. March 11, in the area of 2705 Media Center Drive west of San Fernando Road.

Initial reports indicate that an Amtrak train hit a person on the tracks. It’s unclear why the victim was on the tracks when they were hit.

The Los Angeles Fire Department crews and Los Angeles Police Department officers arrived at the scene shortly after.

The medics confirmed the pedestrian’s death at the site of the collision. The victim’s name, age, and gender were not immediately released.

No one on the train reported any injuries as a result of the collision.

At this time, no additional details on the incident have been released. Investigations are ongoing to establish how and why the accident occurred.

https://www.lapdonline.org/ According to 2025 year-end data from the Los Angeles Police Department (), the city recorded 290 traffic fatalities, a slight 6% decrease from the 302 deaths reported in 2024. Despite this modest decline, the roads remain deadlier than pre-pandemic levels. Pedestrians remain the most vulnerable group, accounting for over 50% of all fatalities (150+ deaths in 2025), while severe injuries citywide have remained high, consistently exceeding 1,500 annually since 2022."
CBMiowFBVV95cUxObUxuQTlJM0RUVXp3SEtBLUxWZFBkbTJ4SjFZcFptUHd3YzgxRDlMX2NWR0Y0NDdxSHl6UGdmU2YtalI3eVpVUzFUVXd5RkhUUER5OGFpTFBRN21pbkVwZnlWRi0zZkZnRUwzbWNsZ21aZkp1d0huRndrYVZyd1BYVGVyS3QweF9GMW9PVDBQYkxyT1dqRHRIdW5zRnN3Y3pIMlVv,https://www.thelegaladvocate.com/news/breaking/yexenia-gonzalez-amtrak-glendale-l-a-union-media-drive,2026-03-12 20:28:32,"Yexenia Gonzalez killed in Glassell Park train crash, LAPD says - The Legal Advocate",tf_html,2026-03-11 11:30:00,"Struck by Amtrak train between Glendale and L.A. Union stations
LOS ANGELES, CA, (March 11, 2026) - A 46-year-old woman was tragically killed in a pedestrian-train accident Wednesday in Glassell Park, a neighborhood in northeast Los Angeles.
Yexenia Gonzalez died after being struck by an Amtrak train on Media Center Drive between the Glendale and L.A. Union stations.
According to the Los Angeles Police Department, Yexenia Gonzalez was struck by Amtrak Pacific Surfliner train 774 between the Glendale and L.A. Union stations. It happened at about 11:30 a.m. in the area of 2705 Media Drive, east of North San Fernando Road.
Gonzalez was pronounced deceased at the scene.
FATAL TRAIN ACCIDENT INVESTIGATION
It was unclear how the woman ended up in the path of the train. Her manner of death wasn't disclosed by the medical examiner’s office.
Train accidents such as this can occur for several reasons, including train personnel error, train track failure, a mechanical error or malfunction, a signalman error, and reckless actions.
According to the National Transportation Safety Bureau (NTSB), approximately 1,000 people are killed in train-related accidents each year. During the probe, investigators will also examine if the crash site was made safe for the pedestrian crossing.
Candice Bond, an experienced train accident attorney, said that in cases such as this that it is imperative to have an independent investigation conducted by a seasoned lawyer as soon as possible to preserve evidence for a victim's family.
“A skilled attorney can protect a grieving family from powerful train companies, which often send their investigators to crash sites and possess a variety of resources they can utilize to defend a negligent party,” said Bond, Managing Partner of Bond Legal and national analyst for The Legal Advocate.
WRONGFUL DEATH CLAIM
Pending results of the investigation, the family members of Yexenia Gonzalez may be entitled to a wrongful death claim. Family members of wrongful death victims may seek damages for loss of love and companionship, pain, suffering and emotional distress following a catastrophic accident such as this incident.
“The stress and sorrow can be extremely overwhelming after losing a loved one in an accident,” said Stefano Formica, Of Counsel with Bond Legal. “We understand just what families are forced to go through, and having their rights protected is vital. A wrongful death lawyer will stay updated on the official investigation and help ensure that their legal rights and best interests are protected.”
(This report is based on verified data - learn more on our About Us page.)
If you or a family member have been involved in a situation similar to this article and would like to speak to our national legal analysts Candice Bond or Stefano Formica free of charge, please use the contact information found on this page.
(Candice Bond, Managing Partner, and Stefano Formica, Of Counsel, at Bond Legal, are the national legal analysts for The Legal Advocate. The Legal Advocate can and does use quotes from prior interviews with our analysts for our news articles. If you would like to contact Bond Legal to help you, please call 866-599-0297 or use the submission box found on this page. Legal analysts quoted may or may not be licensed in your state).
Tags: Latest News, Commercial, Pedestrian Accident, California, Fatal Crash, Train, Glassell Park, Los Angeles, Amtrak, Media Drive, Glendale, L.A. Union, San Fernando"
CBMipwFBVV95cUxOQmRkUXdMTUk4UTJVN2pLRURMSXZkME9ydWpwX09SaE00ZklVY1VTX1FrNlpSUGpiUVQzQkN4SEJ2VFFSZWVJc2FuQm5FcEFiR3RvdjlCN19USlJFTnFPZUhFNk1CT0hsRUVkRU43anViM3lURHRxQVhZYm8xbE82a05reVlSdFYzdjl4OXVwbV95Y3FKT0NyZV9EczEzaURLNURSXzlEbw,https://hoodline.com/2026/03/glassell-park-horror-as-train-strikes-kills-pedestrian-by-warehouse-tracks/,2026-03-11 20:29:36,Deadly Train Accident Near Glassell Park Warehouse - Hoodline,np_html,2026-03-11 11:30:00,"A pedestrian was struck and killed by a train late Wednesday morning in Glassell Park, in a deadly collision that unfolded near a warehouse-lined stretch of tracks. The crash was reported around 11:30 a.m. near 2705 Media Center Drive, where emergency crews pronounced the victim dead at the scene. Responders reported no other patients connected to the incident.

Scene and response

According to the Los Angeles Fire Department, crews from Fire Station 50, along with multiple battalion, engine, and rescue units, responded to the rail emergency and logged the call as Inc#0734. Fire officials reported no additional patients on or around the train and said the Los Angeles Police Department and the Los Angeles County Medical Examiner would handle body recovery under LAPD Inc#2132.

Where it happened

The crash took place in the Media Center industrial corridor of northeast Los Angeles, near a warehouse property at 2705 Media Center Drive. Public records list the address as a large one-story warehouse and distribution site, and the location underscores how rail right-of-way cuts through mixed industrial and residential stretches in the neighborhood. PropertyShark confirms the site details.

Investigation and context

Pedestrian safety continues to pose problems across Los Angeles, and the LAPD has highlighted targeted enforcement and public outreach as part of ongoing efforts to curb traffic deaths. Train-involved collisions in the region have also led to lengthy investigations and service disruptions in the past, as reported by the Los Angeles Times, a reminder of how a single trackside incident can ripple through the broader transportation system.

What's next

LAPD traffic investigators are handling the on-scene probe, while the County medical examiner oversees body recovery and will determine the cause and manner of death. Authorities have not released any identifying information about the victim, and the investigation remains active as agencies say they will share additional details when they are available."
CBMib0FVX3lxTE1tejQ2Q1BXOXZEYWZMNG11d2F0WnZ1YjV0SVBHbVRkWUp0UlRwcEViNl81SGp0MTFQTmN5dWlwcGx4N05MWmRETzVWTExPdWZWWm1kMVdvc3IwLW9pOTBzbGt0WU9ydnhDWllKanlzNNIBb0FVX3lxTFBvMElnN0tsRzhwelVLcng0SVlDcEFibzM5RnU4bEs2Q0tGbkxLSzhseE9uTzJ0c1l1NDJoNjE0aUhTc0ZIclExTWd1UjFzSk4tSlJfSTBiTHNnUXktWDAtUWlPUXYwUGtHQWkxdDdpRQ,https://www.mercedsunstar.com/news/local/article315011054.html,2026-03-11 15:12:00,Family of Atwater man found dead near railroad tracks raising money for funeral - Merced Sun-Star,gs_html,2026-03-06 18:00:00,"The mother of an Atwater man found dead near a railroad crossing on Sunday night has started a GoFundMe fundraiser to help pay for his funeral expenses.

The family is looking to raise money to give Lucas Alexander Raphel Benavidez, 26, a proper funeral.

As of the morning of Friday, March 13, $1,506 raised of the goal of $2K has been raised.

Atwater police closed the railroad crossings on Atwater Boulevard at Applegate Road and on Packers and High Street at about 6 p.m. Sunday to investigate, the Atwater Police Department said on Facebook. The crossings were open a few hours later.

“He was taken from us far too soon in a tragic accident involving a train, leaving a void in our family, our hearts, our lives and those of countless others that can never be filled,” Heather Burns said in the GoFundMe post.

This story was originally published March 11, 2026 at 8:12 AM."
CBMinwFBVV95cUxOV2k0OHhWck9pREQtMTRISmdfZHFFaHlCOGNNUUVSOE5aM3VyWGxXWXVlMDhEVDhPMzBseVU4MmlPbWtqdjZxdHRsdVE2SkhRY21DS2VrX0kwNlNRaDVFVVJ6aEhPdGc5SG1UdlpUWlp5SFducW0tZW5qemsyWTFLSGkxWWNSNGZEYlhydXpNZl9MNWZZb3VkWWtOM3BUNDg,https://www.accidentinjurynews.com/breaking-news/yexenia-gonzalez-dies-los-angeles-train-accident/,2026-03-14 08:07:41,Yexenia Gonzalez dies in northeast Los Angeles train accident - Accident Injury News,gs_html,2026-03-11 11:30:00,"According to the Los Angeles Police Department, Yexenia Gonzalez was hit by Amtrak Pacific Surfliner train 774 at around 11:30 a.m., between the Glendale and L.A. Union stations near 2705 Media Drive, east of North San Fernando Road. Gonzalez was pronounced dead at the scene.

LOS ANGELES, CA (March 11, 2026) — A 46-year-old woman was killed Wednesday morning after being struck by a train in Glassell Park, authorities said.

The circumstances that led to Gonzalez being struck by the train are unclear. Her manner of death has not been disclosed by the medical examiner.

Train accidents can result from factors such as personnel error, track failure, mechanical malfunctions, signal errors, or reckless behavior. Investigators will also review whether the crash site was properly secured for pedestrian safety.

“An independent investigation is crucial to protect a victim’s family and preserve evidence,” said Candice Bond, Managing Partner at Bond Legal.

“Train accidents are complex, and companies often have significant legal resources to defend against liability. An attorney can help families by hiring expert witnesses, reviewing safety and operational records, and locating witnesses to the incident while guiding them through the legal process,” Bond added, according to Accident Injury News.

Pending the outcome of the investigation, the family of Yexenia Gonzalez may be entitled to a wrongful death claim. Families of victims can seek damages for loss of love and companionship, pain and suffering, and emotional distress following a catastrophic accident.

“The grief and shock of losing a loved one in an accident can be overwhelming,” said Stefano Formica, Of Counsel at Bond Legal. “A wrongful death attorney will monitor the official investigation and help ensure that the family’s legal rights and best interests are fully protected.”"
CBMidkFVX3lxTE51QlhUbXd6TXZtZmY5Y3BQM0ROSjZfekFiVXdJOW1uZkVYMHAtY0ZMbm1iTFRqNlRYd3dEaTJaUGwtbkNUOGx5MXA3dWljdER1Zk56UlVQUTRySV9uOGlKM0h6b1gtblNadFA5Ni1fc2FrMlc0Ymc,https://padailypost.com/2026/03/16/train-kills-person-in-san-mateo/,2026-03-16 22:40:55,Train kills person in San Mateo - Palo Alto Daily Post,rd_html,2026-03-16 17:30:00,"Caltrain photo.

A Caltrain hit and killed a person on Saturday in San Mateo, authorities confirmed today (March 16).
The person who died has not been publicly identified by the San Mateo County Coroner’s Office, pending notification of their next of kin.
The crash occurred near E. Bellevue Ave. around 5:30 p.m.
Caltrain has a policy of no longer telling the public about deaths on the tracks in an attempt to prevent copycat suicides. It is not known whether Saturday’s death was an accident or suicide.
Caltrain reported 10 deaths in 2022, 15 deaths in 2023 and 19 deaths in 2024 — the most in a decade.
Another 10 people died last year, according to a fatality log provided by the agency.
If you or someone you know is having a mental health crisis, help is available. Call or text the 24/7 suicide and crisis lifeline at 988."
CBMijAFBVV95cUxPOG0xY2tzLWQ4ZkRiR1ZtVTFKN3JsQmtCYkNnblF5VjlOcGpydTBxY3loNGFVMDZQcXZMLWNUbElEQzV5Wkp6WE5lc1Z3bDEtNDNKOUtHalI1UC1EOGNnZzVveGg5bDgxSmRlT2hJQzRCcGRmYkxkVEJUNTdJZjlPOHlJcjI2U0tRMnZ2Qg,https://www.newsline.com/news/breaking/yexenia-gonzalez-pedestrian-train-media-drive,2026-03-17 05:47:04,Yexenia Gonzalez died in pedestrian crash on Media Drive - newsline.com,tf_url,2026-03-11 11:30:00,"Woman struck by Amtrak Pacific Surfliner train east of North San Fernando Road
March 11, 2026 | Los Angeles, CA
A tragic incident unfolded in the Glassell Park area of northeast Los Angeles when a pedestrian lost her life after colliding with a moving train.
Authorities responded swiftly to the scene, where emergency efforts proved unable to save the victim.
Yexenia Gonzalez, 46, died after an Amtrak Pacific Surfliner train struck a pedestrian near 2705 Media Drive in the Glassell Park area of Los Angeles.
What Happened in the Crash?
The Los Angeles Police Department reported that Yexenia Gonzalez, aged 46, was hit by Amtrak Pacific Surfliner train 774. The collision occurred around 11:30 a.m. near 2705 Media Drive, just east of North San Fernando Road, between the Glendale and Los Angeles Union stations.
- Victim: Yexenia Gonzalez, 46
- Date: March 11
- Time: Approximately 11:30 a.m.
- Location: Glassell Park, Los Angeles, CA – 2705 Media Drive
- Vehicle Involved: Amtrak Pacific Surfliner train 774
- Outcome: Victim pronounced dead at the scene
Gonzalez was declared deceased on-site by medical personnel, marking a somber end to what investigators are still piecing together.
Why Do Train Accidents Like This Occur?
Details surrounding how Gonzalez came into contact with the train remain under review. The Los Angeles County Medical Examiner's Office has not yet released information on the exact manner of death.
Common factors in pedestrian-train incidents include errors by train operators, issues with track infrastructure, mechanical failures in the locomotive, signaling mistakes, or unsafe pedestrian behavior. Officials are assessing whether the area provided adequate safety measures for crossings.
According to the National Transportation Safety Board (NTSB), roughly 1,000 individuals lose their lives annually in accidents involving trains across the United States. This statistic underscores the persistent risks associated with rail travel and pedestrian interactions.
Common Causes of Train Accidents |
Description |
Source |
|---|
Train Personnel Error |
Mistakes by engineers or crew during operation |
NTSB Reports |
Track Failure |
Structural defects or maintenance issues on rails |
Federal Railroad Administration |
Mechanical Malfunction |
Failures in train components like brakes or signals |
NTSB Investigations |
Signalman Error |
Incorrect signaling leading to collisions |
Industry Safety Data |
Reckless Actions |
Unauthorized crossings or distractions |
Pedestrian Safety Studies |
Legal Insights
In situations involving fatal train collisions, securing a thorough, independent review is crucial for affected families. National legal analyst Candice Bond, managing partner of Bond Legal, emphasizes the need for prompt action.
“A skilled attorney can protect a grieving family from powerful train companies, which often send their investigators to crash sites and possess a variety of resources they can utilize to defend a negligent party,” said Bond.
- Preserve physical evidence immediately to build a strong case
- Counter the influence of large rail operators through professional representation
- Explore potential liabilities tied to safety protocols or equipment
Stefano Formica, of counsel with Bond Legal, highlights the emotional toll on survivors.
“The stress and sorrow can be extremely overwhelming after losing a loved one in an accident,” said Formica. “We understand just what families are forced to go through, and having their rights protected is vital. A wrongful death lawyer will stay updated on the official investigation and help ensure that their legal rights and best interests are protected.”
Families of victims in wrongful death scenarios may pursue compensation for emotional distress, loss of companionship, and related hardships stemming from the tragedy.
Newsline, the premier digital news platform owned by Belsito Communications, Inc., upholds rigorous editorial standards with an unwavering commitment to journalistic integrity and editorial excellence.
For transparency, our Corrections Policy ensures a 24-hour review guarantee on all published content.
(This report is based on verified data - learn more on our About Us page.)
Newsline - is your trusted source for legal news and accident reports, delivering timely updates to keep you informed.
Candice Bond, national legal analyst for Newsline, has extensive experience with fatal pedestrian accidents. If you or a loved one needs help, she offers free consultations.
(Candice Bond, our national legal analyst, is a Managing Partner at Bond Legal. Newsline can and does use quotes from prior interviews with our analysts for our news articles. If you would like to contact Bond Legal to help you, please call 866-985-6515 or use the submission box found on this page. Legal analysts quoted may or may not be licensed in your state)."
CBMilAFBVV95cUxOSlVXcmVRSnI4RllFdW54RzF2OFJUazZjU1BPbzVtVW81dTZqdnpJd0V0a3BWakg3T19WQlh0YnNsRlZ4WXV6dUJXZHBpY2VrRmp2NjJ2S3JLdXp5MXRpcHk5cVBiclVIWGhuNGNvamxKNFE3RVozQkN0dVhGX0pXMlByWkJmMzhzb0dhSUttNmlyVWFY,https://www.thelegaladvocate.com/news/breaking/robert-thomas-jr-killed-train-crash-salinas,2026-03-18 05:44:53,"Robert Thomas Jr. killed in Salinas train crash, coroner says - The Legal Advocate",tf_html,2026-03-17 00:00:00,"49-year-old Salinas resident dies in train crash Monday night
SALINAS, CA, (March 18, 2026) - A 49-year-old man was struck and killed by an Amtrak train near the Salinas station Monday night, authorities said.
Robert Rufus Thomas Jr., 49, was fatally hit by an Amtrak train near the Salinas station Monday night.
The Monterey County Coroner's Office identified the victim as Robert Rufus Thomas Jr. of Salinas.
It was not immediately known exactly when the crash involving an Amtrak Coast Starlight train occurred. The incident delayed the train service for several hours.
This is an ongoing investigation.
CRASH INVESTIGATION NEEDED
Each year, hundreds of people are killed in train-related crashes across the United States, often at poorly marked crossings or where signals malfunction or fencing is inadequate. Railroad deaths totaled 954 in 2024, a 1% drop from the revised 2023 total of 967, according to a report from the National Safety Council.
Candice Bond, an experienced train accident attorney, said that in cases such as this, it is imperative to have an independent investigation conducted by a seasoned lawyer as soon as possible to preserve evidence for a victim's family.
“A skilled attorney can protect a grieving family from powerful train companies, which often send their investigators to crash sites and possess a variety of resources they can utilize to defend a negligent party,” said Bond, Managing Partner of Bond Legal.
“Time is of the essence in cases such as this, and the victim must ensure that evidence is reviewed efficiently.”
WRONGFUL DEATH CLAIM
Pending the investigation, the family members of Robert Rufus Thomas Jr. may be entitled to a wrongful death claim. Family members of wrongful death victims may seek damages for loss of companionship, pain, suffering, and emotional distress following a catastrophic accident.
“The stress and sorrow can be extremely overwhelming after losing a loved one in an accident,” said Stefano Formica, Of Counsel with Bond Legal.
“A wrongful death lawyer will stay updated on the official investigation and help ensure that the victim's legal rights and best interests are protected.”
(This report is based on verified data - learn more on our About Us page.)
Have you been in a similar accident and need help? Speak to one of The Legal Advocate's national legal analysts now free of charge for a no-obligation.
(Candice Bond, Managing Partner, and Stefano Formica, Of Counsel, at Bond Legal, are the national legal analysts for The Legal Advocate. The Legal Advocate can and does use quotes from prior interviews with our analysts for our news articles. If you would like to contact Bond Legal to help you, please call 866-599-0297 or use the submission box found on this page. Legal analysts quoted may or may not be licensed in your state)."
