news_id,url,pub_date,title,selected_crawler,accident_date,content,1,1a,1b,2,2a,2b,3,3a,3b,4_1,4_2,5_1,5_2,5_3,6_1,6_2,7,8,9,10_1,10_2,11,12_1,12_2,13_1,13_2,13_3,14_1,14_2,15_1,15_2,16_1,16_2,17_1,17_2,17_3,18,19_1,19_2,20a_1,20a_2,20b_1,20b_2,20c,21_1,21_2,22_1,22_2,23_1,23_2,24_1,24_2,25_1,25_2,26,27,28,29,30_1,30_2,30_3,31_1,31_2,32_1,32_2,32_3,33,34_1,34_2,35_1,35_2,36_1,36_2,37_1,37_2,38,39_1,39_2,40_1,40_2,41_1,41_2,41_3,42_1,42_2,43_1,43_2,43_3,44_1,44_2,45_1,45_2,46_1,46_2,47,48,49_1,49_2,50,51_1,51_2,52_1,52_2,53a_1,53a_2,53b,54,55,56,57
CBMikAFBVV95cUxORm02T0U3cklkVzdFU0EwR0IzRWYxeGtmOERMcWctYlRtSjFPVEthSWdDWVBORjR4Vl9CMzl0bUI2NFJVb2R1aUZoRVdacFI2T3dOYl8wMnNoakdkVzNmLUE5b3RZTmY1N1AzbkJrR1UyV2Z6b2RWbkkwTmNDeTY3bWVUMUlsM3ZQaktmdW9BUE7SAZYBQVVfeXFMTm1QejNQeW9sRVFDMHA2ZTktT1lyY2s1V3hpVy1XOUtlcGVvSjhWdkMybmpVblB4bHVTak1odmpJUTlmLXBDb3U3LXRjUU1tV1otVU9mb2VKN0ZMMFdFcTJjVF9DY2dIanlNQ2tNdk5vdUFIeWF4ZFpVUG9pVzh3VGU4RGxjTlFzU2l0RVd3b3ZWZV9sdWRR,https://www.mercurynews.com/2026/02/14/train-collides-with-car-on-tracks-in-emeryville/,2026-02-15 06:07:38,Train collides with car on tracks in Emeryville - The Mercury News,gs_url,2026-02-15 01:00:00,"A train collided with a car stuck on the tracks in Emeryville early Saturday morning, according to a police department press release.

Shortly after 1 a.m., a woman reportedly turned onto the railroad tracks and became stuck. She exited the vehicle before an oncoming train hit it. The vehicle subsequently caught fire.

Authorities stated that the railway was shut down temporarily so emergency response, fire suppression, vehicle removal and a full inspection of the tracks could take place. The police worked with Union Pacific Railroad and the Alameda County Fire Department to handle the incident. The vehicle was taken off the tracks without further incident. There were no injuries and no signs of impairment.",Union Pacific Railroad,Unknown,Unknown,Unknown,Unknown,Unknown,Union Pacific Railroad,Unknown,Unknown,Unknown,Unknown,Unknown,Unknown,Unknown,1:00,AM,Unknown,Unknown,Alameda County,CA,Unknown,Emeryville,Unknown,Unknown,A,A,Unknown,Unknown,Unknown,Unknown,Unknown,1,1,Unknown,Unknown,Unknown,Unknown,1,Unknown,4,Unknown,1,Unknown,Unknown,Unknown,Unknown,4,Dark,Unknown,Unknown,Unknown,Unknown,1,Main,Unknown,Unknown,Unknown,Unknown,Unknown,Unknown,Unknown,Unknown,Unknown,Unknown,Unknown,Unknown,Unknown,Unknown,Unknown,Unknown,Unknown,Unknown,Unknown,Unknown,Unknown,Unknown,2,Female,2,No,5,Other (specify),Turned onto tracks and became stuck,Unknown,Unknown,Unknown,Unknown,Unknown,3,Uninjured,2,"No, she exited the vehicle before the collision.",0,0,Unknown,1,0,0,Unknown,1,"Yes, likely by Union Pacific Railroad.",0,0,No,No,Unknown,"A car driven by a woman became stuck on railroad tracks in Emeryville shortly after 1 a.m. Saturday, resulting in a collision with an oncoming train. The woman safely exited her vehicle before it was hit and subsequently caught fire, with no injuries or impairment reported.",Unknown,Unknown,Unknown
CBMirgFBVV95cUxPM250V0NGbHdIcS1GQVpuZkRuTXlHZHJUN1BJejE4VlJFZ19xM1lKRmxmV3MxNHJiM0FCdzJrSWxDRUs0WVAxd0lVcDA5T3RhcmthX1gtQmF3TkxobG9faFFHai1GTkd4bWczbDVYQ3ZyRWcyM1ZHaTNSZjVnZy10Vnl3azV3eC13QXBaMEt4ZWJHTGdfUlg2bUUzRWFxaVUwM2hlVUFtZzZlNEdwNFE,https://www.sacramentoinjuryattorneysblog.com/pedestrian-killed-after-being-struck-by-train-near-chico-state/,2026-02-19 00:49:19,Pedestrian Killed After Being Struck by Train Near Chico State Campus - sacramentoinjuryattorneysblog.com,np_html,2026-02-09 01:51:00,"February 18, 2026 Edward Smith

Pedestrian Killed After Being Struck by Train Near Chico State Campus

A pedestrian killed after being struck by train near Chico State early Monday morning, February 9, 2026, according to the Chico Police Department. The fatal collision occurred at approximately 1:51 a.m. near West Sacramento Avenue and North Cedar Street, close to the Chico State campus and nearby student housing.

What Happened

Police officers responding to the scene found an adult male deceased on the railroad tracks. Authorities reported that the engineer of a northbound Amtrak train saw a person on the tracks but was unable to stop the train in time to avoid the collision.

Witness interviews and preliminary findings indicate there were no suspicious circumstances leading up to the incident, though the investigation remains ongoing. The train remained stopped at the scene for approximately two hours, while vehicle traffic in the surrounding area was not impacted.

Chico police stated that the man is not believed to be a Chico State student. The Butte County Sheriff’s Office has taken custody of the remains, and the victim’s identity is being withheld pending notification of next of kin.

Investigation Ongoing

Authorities have a preliminary identification of the deceased but will not release the name until family members are notified. Law enforcement continues to review the circumstances surrounding the incident.

Railroad & Pedestrian Safety

Railroad tracks are extremely dangerous areas, particularly at night when visibility is limited. Trains require long distances to stop and cannot maneuver to avoid pedestrians. Individuals are urged to stay clear of tracks at all times, obey posted warnings, and avoid walking near rail lines, especially in low-light conditions.

Check out this video with accident attorney Ed Smith to discover how to select the best injury lawyer for your claim:

Why Families May Need a Personal Injury Attorney

In fatal accidents involving trains, families are often left with unanswered questions while coping with profound loss. A personal injury attorney can help surviving family members understand their legal rights, investigate whether safety measures were adequate, and determine whether compensation may be available through wrongful death claims.

Chico & Northern California Wrongful Death Attorneys

The compassionate injury attorneys at AutoAccident.com, led by Ed Smith, have decades of experience assisting families affected by fatal accidents throughout Northern California. The firm offers free consultations and works on a contingency-fee basis, meaning there are no legal fees unless compensation is recovered.

If you have lost a loved one in a fatal accident, call (916) 921-6400 to speak with an experienced wrongful death attorney.",Amtrak,Unknown,Unknown,Unknown,Unknown,Unknown,Unknown,Unknown,Unknown,Unknown,Unknown,02,09,2026,1:51,AM,Unknown,Unknown,Butte County,CA,Unknown,Chico,Unknown,Unknown,K,Pedestrian,Unknown,Unknown,Unknown,1,1,Unknown,Unknown,1,Unknown,Unknown,Unknown,1,Unknown,4,Neither,4,Neither,Unknown,Unknown,Unknown,4,Dark,Unknown,Unknown,2,Passenger Train-Pulling,1,Main,Unknown,Unknown,Unknown,Unknown,Unknown,Unknown,Unknown,1,North,Unknown,Unknown,Unknown,Unknown,Unknown,Unknown,Unknown,Unknown,Unknown,Unknown,2,2,Unknown,1,Male,2,No,5,Other,Person on the tracks,Unknown,Unknown,8,Not obstructed,,Unknown,Unknown,Unknown,Unknown,1,0,0,0,0,0,Unknown,1,investigation remains ongoing,0,0,No,Yes,"This section advises families of fatal accident victims on why they may need a personal injury attorney to understand legal rights, investigate circumstances, and pursue potential wrongful death claims, while also promoting the services of AutoAccident.com and including a video link on how to select an injury lawyer.","A pedestrian was fatally struck by a northbound Amtrak train near Chico State campus on February 9, 2026, at approximately 1:51 a.m. The engineer saw the person but was unable to stop in time, and police found the adult male deceased with no suspicious circumstances indicated.","Edward Smith, Accident Attorney",Unknown,"February 18, 2026"
CBMigwFBVV95cUxOZndNSlA4SjhZSVVnSGd5b3lJTXlRY0w1NEt2QVpIeVJVRXU5dzNHUlVXUF9jMGpqNS1DUDVraHp4ZDZkM1hoYWdheTNnRFdEbEl1eUtRWkVRTC1DQ1NEbnhRUDN1VDdFOXdSR2ZxZzAwU0NwaHA1OUtTZF9IS1c5dmxMUQ,https://www.aol.com/news/metrolink-train-semi-collide-moorpark-001234616.html,2026-02-20 02:52:40,"Metrolink train and semi collide in Moorpark, killing truck's driver - AOL.com",tf_html,2026-02-19 14:15:00,"Metrolink train and semi collide in Moorpark, killing truck's driver
A semitruck collided with a Metrolink train in an agricultural area of Moorpark on Wednesday afternoon, killing the truck driver and sending one of the train passengers to the hospital, authorities said.
Metrolink train 118 struck a truck and trailer at a crossing on private farmland near the intersection of Los Angeles Avenue and Montair Drive at 2:15 p.m., according to a Metrolink spokesperson. The truck driver was pronounced dead at the scene, and one of the train's 11 passengers was transported to a local hospital for treatment in unknown condition, the spokesperson said.
The truck was severely damaged in the collision. A section of the vehicle was pushed one-third of a mile down the track, said Fire Department spokesperson Andy VanSciver. All five train cars and the engine remained upright on the tracks following the collision.
Advertisement
The cause of the accident is currently unknown. Train crossings on agricultural land in Ventura County are typically marked with stop signs and signs directing drivers to look both ways, said VanSciver.
As a result of the collision, Metrolink service that regularly operates to Ventura East Station was only operating as far as Moorpark. Metrolink on Wednesday afternoon was working to provide alternative transportation and Uber vouchers to affected customers, who can call their customer hotline at (800) 371-5465 for assistance.
This story originally appeared in Los Angeles Times.",Metrolink,Unknown,Unknown,Semitruck,Unknown,Unknown,Metrolink,Unknown,Unknown,Unknown,Unknown,Unknown,Unknown,Unknown,2:15,PM,Moorpark,Unknown,Ventura,CA,Unknown,Moorpark,Los Angeles Avenue and Montair Drive,Private,C,Semitruck / Truck and trailer,Unknown,Unknown,Unknown,Unknown,Unknown,Unknown,Unknown,1,Unknown,Unknown,Unknown,1,Unknown,Unknown,Unknown,Unknown,Unknown,Unknown,Unknown,Unknown,2,Day,Unknown,Unknown,3,Metrolink train,1,Main line,Unknown,Unknown,1,5,Unknown,Unknown,Unknown,Unknown,Unknown,8,"8, 11",signs directing drivers to look both ways,Unknown,Unknown,Unknown,Unknown,Unknown,Unknown,Unknown,Unknown,Unknown,Unknown,Unknown,Unknown,2,No,Unknown,Unknown,Unknown,3,Unknown,Unknown,Unknown,Unknown,1,Killed,1,Yes,1,0,Unknown,1,0,0,Unknown,Unknown,Unknown,0,1,No,No,Unknown,"A Metrolink train collided with a semitruck on private farmland in Moorpark, resulting in the death of the truck driver and one train passenger being hospitalized. As a result of the collision, Metrolink service to Ventura East Station was partially suspended, with alternative transportation provided to affected customers.",Unknown,Unknown,Unknown
CBMikgFBVV95cUxPUndmYmxHNGRPU21rZ0lSQWVVTUY2SWFpeVhpN0JRODB1QWVzUnZkZHVjNUY1YUNUNGducXNTclNSZlRWMkthTWQxYVNrMFZGTXVqSldkRTVCdTNFUFFsQXNSUm1NN0xPT3hkUHl6bmlvT1JQSENONkV0TDAyWHNOUXpNUVVCM21QU0p2T2NDdXl6QQ,https://www.cbsnews.com/sacramento/news/yuba-county-wheatland-freight-train-fatal-crash/,2026-02-17 16:43:08,"Freight train strikes vehicle near Wheatland, woman dies - CBS News",gs_html,2026-02-17 02:00:00,"Authorities say a woman has died after an early morning crash on the train tracks in Yuba County.

California Highway Patrol says the crash happened a little after 2 a.m. near Highway 65 and Dairy Road, just outside of the town of Wheatland.

Officers responded to the scene and found that a freight train had struck a Toyota Prius that was on the tracks, sending the vehicle rolling. The train was stopped after the crash.

The driver was identified as a 58-year-old woman. She was out of her vehicle, officers say, and died from her injuries.

Exactly what led up to the crash is under investigation, CHP says, with the name of the driver being withheld at this time.",Unknown,Unknown,Unknown,Unknown,Unknown,Unknown,Unknown,Unknown,Unknown,Unknown,Unknown,Unknown,Unknown,Unknown,2:00,AM,Unknown,Unknown,Yuba,CA,Unknown,Unknown,Highway 65,Public,A,Unknown,Unknown,Unknown,Unknown,Unknown,Unknown,Unknown,Unknown,1,Freight train,Unknown,Unknown,1,Unknown,4,Unknown,4,Unknown,Unknown,Unknown,Unknown,4,Dark,Unknown,Unknown,1,Freight Train,Unknown,Unknown,Unknown,Unknown,Unknown,Unknown,Unknown,Unknown,Unknown,Unknown,Unknown,Unknown,Unknown,Unknown,Unknown,Unknown,Unknown,Unknown,Unknown,Unknown,Unknown,Unknown,Unknown,58,2,Female,2,No,Unknown,Unknown,Unknown,3,Unknown,Unknown,Unknown,Unknown,1,died from her injuries,2,She was out of her vehicle,1,0,Unknown,1,0,0,Unknown,Unknown,Unknown,0,0,No,No,Unknown,"A 58-year-old woman died after her Toyota Prius was struck by a freight train on the tracks near Highway 65 and Dairy Road in Yuba County a little after 2 a.m.
The vehicle was sent rolling, and the driver, found outside her car, succumbed to her injuries, with authorities currently investigating the exact cause of the crash.",Unknown,Unknown,Unknown
CBMiqwFBVV95cUxOYkxpYWx4RXBTLW9PVzhnQnVZanNJVG9lbmNFbWVubGJ5S1lGckdnNXNwUFlzQkVsSk5iWjdtdkFRMEx3c256OGZYdTc2RzVVNkRyMTRqSFVrSnV6R2hzQXZrQVZ5bklnZnRmb3JrSjdnemtyUVl3Q2QtVGkteUF4X1djbGc3WTFhZXNRTG84R2hDUl9Gd1A3bDNKZ01ERUZJZjJUYjRpQUN5MUE,https://www.sacramentoinjuryattorneysblog.com/woman-killed-in-train-collision-near-highway-65-in-wheatland/,2026-02-20 21:10:14,Woman Killed in Train Collision Near Highway 65 in Wheatland - sacramentoinjuryattorneysblog.com,tf_html,2026-02-17 02:00:00,"Woman Killed in Train Collision Near Highway 65 in Wheatland
Woman Killed in Train Collision Near Highway 65 in Wheatland
Authorities are investigating a fatal crash that occurred early Tuesday morning, February 17, 2026, in Yuba County that left a woman killed in train collision near Highway 65 Wheatland.
According to the California Highway Patrol, the collision happened shortly after 2:00 a.m. near the intersection of State Route 65 and Dairy Road, just outside the city limits.
Officers responding to the scene determined that a freight train struck a Toyota Prius that was positioned on the railroad tracks, causing the vehicle to roll upon impact. The train came to a stop following the collision.
Authorities reported that the driver, a 58-year-old woman, was outside of her vehicle at the time of the incident. She sustained fatal injuries and was pronounced dead at the scene. Her identity is being withheld pending notification of next of kin.
Investigators are working to determine the circumstances that led to the vehicle being on the tracks. The incident remains under active investigation.
Safety Tips Around Railroad Crossings
Railroad incidents are often catastrophic due to the size and stopping distance of trains. Drivers can help reduce the risk by:
- Never stopping or parking on railroad tracks
- Obeying all crossing signals, gates, and warning lights
- Looking both ways before crossing, even if signals are not active
- Avoiding distractions and staying alert near rail crossings
- Exiting the vehicle immediately and moving away from the tracks if a car becomes stuck
Trains require a long distance to come to a complete stop, making early caution essential.
Check out this video with accident attorney Ed Smith to discover how to select the best injury lawyer for your claim:
Why Legal Guidance May Be Important After a Fatal Crash
Fatal collisions involving trains and motor vehicles often require a thorough investigation to determine all contributing factors. In some cases, liability may involve roadway design, crossing conditions, visibility issues, mechanical problems, or other third-party factors.
An experienced wrongful death attorney can:
- Conduct an independent investigation
- Preserve critical evidence and accident data
- Work with reconstruction and safety experts
- Identify all potentially responsible parties
- Help families pursue compensation for funeral expenses, lost financial support, and loss of companionship
- Handle communications with insurance companies and involved entities
Taking prompt action can help protect important evidence and your family’s legal rights.
Contact Ed Smith – Northern California Accident Attorney
If your family has lost a loved one in a serious crash, you may have the right to seek compensation. The Law Offices of Ed Smith has helped Northern California families for decades, providing compassionate representation during difficult times.
Our team performs detailed investigations, works with industry experts, and is committed to pursuing full and fair compensation for our clients.
For free, friendly advice, call (916) 921-6400 or (800) 404-5400.
There is no fee unless we win your case, and all consultations are confidential. Let our experienced team help you understand your rights and the next steps forward.",Unknown,Unknown,Unknown,Unknown,Unknown,Unknown,Unknown,Unknown,Unknown,Unknown,Unknown,02,17,2026,2:00,AM,Unknown,Unknown,Yuba County,CA,Unknown,Unknown,State Route 65,Public,A,Toyota Prius,Unknown,Unknown,Unknown,Unknown,Unknown,2,Stopped on crossing,1,Unknown,Unknown,Unknown,1,Unknown,4,Neither,4,Neither,Unknown,Unknown,Unknown,4,Dark,Unknown,Unknown,1,1,Unknown,Unknown,Unknown,Unknown,Unknown,Unknown,Unknown,Unknown,Unknown,Unknown,Unknown,Unknown,Unknown,Unknown,Unknown,Unknown,Unknown,Unknown,Unknown,Unknown,Unknown,Unknown,Unknown,58,2,Female,2,No,4,Stopped on crossing,Unknown,3,Unknown,Unknown,Unknown,Unknown,1,Killed,2,"No, the driver was outside of her vehicle at the time of the incident.",1,0,Unknown,1,0,0,Unknown,1,"Yes, authorities are investigating the incident.",0,0,No,No,Video with accident attorney Ed Smith on how to select the best injury lawyer for your claim.,"A 58-year-old woman was killed on February 17, 2026, near Highway 65 and Dairy Road in Wheatland when a freight train struck her Toyota Prius that was on the railroad tracks. She was found outside her vehicle and pronounced dead at the scene after sustaining fatal injuries.",Ed Smith – Northern California Accident Attorney,Unknown,"February 17, 2026"
CBMic0FVX3lxTE56WWVsUzhVZExSVUpEa0FScTM3T3A3YkpfRnZNSkNrXy1VcEdFQlB6RlJDYk0tWDhSMzEzeVFQaFk1Y0tmSkZ6QWx6WHh2MTl5STZUUnBvaTF3enozN0hOWGdHcjdoTGlOWlI3LVBTa2RoWDQ,https://azat.tv/en/wrongful-death-attorneys-california-tragedies/,2026-02-21 12:45:25,Wrongful Death Attorneys Navigate Complex California Tragedies - Azat TV,gs_html,2026-02-17 00:00:00,"SACRAMENTO (Azat TV) – Recent, tragic incidents across California, including a deadly avalanche in the Sierra Nevada and a fatal train collision near Wheatland, have thrust the critical role of wrongful death attorneys into the spotlight. These cases highlight the complex legal landscape families face when seeking accountability and compensation after unexpected fatalities, especially when questions of negligence or liability arise.

On February 17, 2026, a 58-year-old woman was killed in a train collision near State Route 65 and Dairy Road in Wheatland, Yuba County, when a freight train struck her Toyota Prius. Authorities confirmed the driver was outside her vehicle at the time of impact. Just days later, on February 21, 2026, a massive avalanche in the remote Sierra Nevada wilderness claimed eight lives and left one presumed dead during a guided backcountry ski trip. Both incidents are under active investigation, raising profound questions about the circumstances leading to these deaths and the potential for legal recourse through wrongful death claims.

The California avalanche, which involved clients of Blackbird Mountain Guides, has sparked an unusual criminal negligence investigation by the Nevada County Sheriff’s Office, a move legal experts describe as having scant precedent. Typically, backcountry tour clients sign liability waivers that shield guide companies. However, according to Utah ski injury attorney Rob Miner, these waivers do not absolve guides of responsibility if they fail to follow appropriate safety protocols or adequately inform clients of risks. Miner emphasized, “They’re guides. It is presumed they will not guide you into an experience that may kill you, or that creates an unreasonable risk of death.”

The investigation is scrutinizing the guides’ decision to embark on the three-day trip with 11 clients amidst intensifying storm warnings and then to ski out on Tuesday as avalanche conditions worsened. This slide was the deadliest in the U.S. since 1981, making the scale and the decision-making process pivotal for investigators. Attorney Andrew McDevitt noted that while skiing is recognized as inherently dangerous, the specific circumstances of this incident are drawing a closer look. Ravn Whitington, an attorney specializing in ski injury and wrongful death cases near the avalanche site in Truckee, California, acknowledged the ongoing speculation, stating that much of what investigators know remains undisclosed to the public.

In the aftermath of the Wheatland train collision, the California Highway Patrol is actively investigating the factors that led to the vehicle being on the railroad tracks. Such incidents are often catastrophic, necessitating thorough investigations to determine all contributing factors, which can include roadway design, crossing conditions, visibility issues, or mechanical problems. In these complex scenarios, an experienced wrongful death attorney plays a crucial role in advocating for the victim’s family.

Wrongful death attorneys conduct independent investigations, working to preserve critical evidence and accident data. They often collaborate with reconstruction and safety experts to identify all potentially responsible parties, which can extend beyond the immediate incident to include third-party factors. Their expertise is vital in helping families pursue compensation for various damages, including funeral expenses, lost financial support, and the profound loss of companionship. Furthermore, these legal professionals manage communications with insurance companies and other involved entities, allowing grieving families to focus on healing without the added burden of legal complexities.

Both the avalanche and train collision cases underscore the specialized knowledge required to navigate wrongful death claims. In California, courts recognize skiing as an inherently dangerous activity, meaning recreational skiers assume certain risks. However, the unique circumstances of the guided avalanche trip, particularly the alleged disregard for severe weather warnings, could form the basis for successful claims of criminal negligence or civil liability against the guide company. Similarly, in train collisions, determining liability often involves extensive technical and legal analysis to identify all contributing factors and potentially responsible parties.

The confluence of these high-profile tragedies in California highlights the increasing demand for specialized legal counsel capable of dissecting complex accident scenarios, challenging liability waivers, and ensuring that families receive comprehensive support and justice in the face of profound loss.",Unknown,Unknown,Unknown,Unknown,Unknown,Unknown,Unknown,Unknown,Unknown,Unknown,Unknown,2,17,2026,Unknown,Unknown,Unknown,Unknown,Yuba County,CA,Unknown,Wheatland,State Route 65,Public,A,A,Unknown,Unknown,Unknown,Unknown,Unknown,Unknown,Unknown,1,freight train,Unknown,Unknown,1,Rail equipment struck highway user,4,Unknown,4,Unknown,Unknown,Unknown,Unknown,Unknown,Unknown,6,Snow,1,Freight Train,Unknown,Unknown,Unknown,Unknown,Unknown,Unknown,Unknown,Unknown,Unknown,Unknown,Unknown,Unknown,Unknown,Unknown,Unknown,Unknown,Unknown,Unknown,Unknown,Unknown,Unknown,Unknown,Unknown,58,2,Female,3,Unknown,5,Other (specify),Driver was outside vehicle,3,Unknown,7,Other (specify),Unknown,1,Killed,2,No,1,0,Unknown,1,0,0,Unknown,Unknown,Unknown,0,0,No,No,Unknown,"On February 17, 2026, a 58-year-old woman was killed in a train collision near State Route 65 and Dairy Road in Wheatland, Yuba County, when a freight train struck her Toyota Prius. Authorities confirmed the driver was outside her vehicle at the time of impact, and the incident is under active investigation.",Unknown,Unknown,Unknown
