news_id,url,pub_date,title,selected_crawler,accident_date,content,1,1a,1b,2,2a,2b,3,3a,3b,4_1,4_2,5_1,5_2,5_3,6_1,6_2,7,8,9,10_1,10_2,11,12_1,12_2,13_1,13_2,13_3,14_1,14_2,15_1,15_2,16_1,16_2,17_1,17_2,17_3,18,19_1,19_2,20a_1,20a_2,20b_1,20b_2,20c,21_1,21_2,22_1,22_2,23_1,23_2,24_1,24_2,25_1,25_2,26,27,28,29,30_1,30_2,30_3,31_1,31_2,32_1,32_2,32_3,33,34_1,34_2,35_1,35_2,36_1,36_2,37_1,37_2,38,39_1,39_2,40_1,40_2,41_1,41_2,41_3,42_1,42_2,43_1,43_2,43_3,44_1,44_2,45_1,45_2,46_1,46_2,47,48,49_1,49_2,50,51_1,51_2,52_1,52_2,53a_1,53a_2,53b,54,55,56,57
CBMijgFBVV95cUxQdzNSdklOb2x1R0JmYkZxaEZvRnNDT3pvZU1SVEdZT292dzRNeG0zTkMwUWxDWWc1NHBFTVZZYl93QlRubTdodjFvSmtKRXA0Nk9aWEdUYjc2NDd1M3k5R25GR0V6b1dDcGNwb3RXMVBEbGREVUpLYXBJNEVOTi1QMGFFenQ0N2pIZm0xZ2R3,https://patch.com/california/los-angeles/man-killed-fall-while-getting-la-metro-train,2026-02-24 20:17:58,Man Killed In Fall While Getting Off LA Metro Train - Patch,rd_html,2026-02-24 17:45:00,"LOS ANGELES, CA — A man died Monday after he lost his balance and fell between two Metro train cars while exiting the train in downtown Los Angeles.The Los Angeles Fire Department responded to the 7th Street/Metro Center station at around 5:45 p.m. Monday, where they extricated the man from the tracks, CBS Los Angeles reported. The man fell as he was exiting the E Line train. He lost his balance as he was walking on the platform and fell between the couplers, which connect train cars together, Metro said in a statement.The man was transported to a local hospital in critical condition. He was later pronounced dead, according to Metro. City News Service contributed to this report.",Metro,Unknown,Unknown,Unknown,Unknown,Unknown,Metro,Unknown,Unknown,Unknown,Unknown,Unknown,Unknown,Unknown,5:45,PM,7th Street/Metro Center station,Unknown,Los Angeles,CA,Unknown,Los Angeles,Unknown,Unknown,M,Unknown,Train,0,Unknown,Unknown,Unknown,Unknown,Unknown,D,Unknown,Unknown,Unknown,Unknown,Unknown,4,Unknown,4,Unknown,Unknown,Unknown,Unknown,Unknown,Unknown,Unknown,Unknown,D,Metro E Line train,1,Main,Unknown,Unknown,0,Unknown,Unknown,Unknown,Unknown,Unknown,Unknown,12,Unknown,Unknown,Unknown,Unknown,Unknown,Unknown,Unknown,Unknown,Unknown,Unknown,Unknown,Unknown,1,Male,2,No,5,Other,Lost balance and fell between train cars while exiting,Unknown,Unknown,Unknown,Unknown,Unknown,Unknown,Unknown,Unknown,Unknown,0,0,Unknown,Unknown,0,0,Unknown,Unknown,Unknown,1,0,No,No,Unknown,"A man died Monday after losing his balance and falling between two Metro train cars while exiting an E Line train at the 7th Street/Metro Center station in downtown Los Angeles. He was extricated from the tracks by the Los Angeles Fire Department, transported to a local hospital in critical condition, and later pronounced dead.",Unknown,Unknown,Unknown
CBMif0FVX3lxTFB6TTVESG5ISWxWN05PSTV5TWtodVFqNFZFOHFtaGtDX3BLa0ozWXo1a1ZNQ19fdGNhZGp2dEh6eExRc1l0R3htVXBSYkNKRWJsZS1yVktVMTFsZjBpN3JiZEVMQlp3ejRUZ1VEZ01NcVpSM2Q2ZWdCX0lObV9YX0k,https://www.truckinginfo.com/news/missed-turn-causes-train-truck-collision,2026-03-04 08:40:49,Missed Turn Causes Train-Truck Collision - Heavy Duty Trucking,tf_html,2026-02-28 06:00:00,"Seven people were hurt and a $1.5 million oversize load was destroyed last week near Los Angeles when a truck driver missed his turn and bottomed out on railroad tracks, where the rig was hit by a commuter train.
The crash happened early Friday morning in Glendale, CA. The truck, operated by Mercury Transportation of Houston and escorted by California Highway Patrol vehicles, continued straight on over the tracks instead of making the left turn it was supposed to. CHP officers alerted the caravan to the mistake and told the trucker to retrace his steps. When he crossed back over the tracks, the 110,000-pound, 19-foot-high carbon dioxide condensing unit got stuck. The warning gates came down, and less than a minute later, the Metrolink train crashed into the truck. The driver, who had gotten out of the cab to try to raise the trailer, was not injured. Seven people on the train received minor injuries.
In a preliminary investigation, officials said that the ultimate responsibility for the accident lies with the driver, and not with the pilot vehicle or the CHP officers contracted to escort them.
Although the CHP was hired to escort the truck, its responsibility was to make sure that other motorists are not hurt or damaged by the truck, according to the patrol. It's the pilot vehicle and the truck driver's responsibility to get there safely, a CHP spokesman told the Los Angeles Times.
Officials are also investigating the possible lack of an oversized permit for the load to travel through Glendale.
Missed Turn Causes Train-Truck Collision
Seven people were hurt and a $1.5 million oversize load was destroyed last week near Los Angeles when a truck driver missed his turn and bottomed out on railroad tracks, where the rig was hit by a commuter train
More Safety & Compliance
CVSA Issues New Inspection Guidance on ELD Tampering, False Logs
New guidance for commercial vehicle inspectors distinguishes between more traditional logbook violations and tampered ELD data that can result in mandatory 10-hour out-of-service orders.
Read More →FMCSA Reinstates Field Warrior ELD to Registered Device List
One electronic logging device has been reinstated to the FMCSA's list of registered ELDs.
Read More →Daimler Truck North America Adds 360-Degree Exterior Camera System to Vocational, Medium-Duty Trucks
Daimler’s new factory-installed system integrates side and forward-facing cameras with in-cab touchscreen to improve jobsite visibility and reduce upfit complexity.
Read More →Kodiak Integrates HAAS Alert’s Safety Cloud into Autonomous Trucking Platform
Kodiak has integrated HAAS Alert’s Safety Cloud platform into its autonomous vehicle control system to send real-time digital hazard alerts to nearby motorists.
Read More →The New Cargo Theft Playbook — And How Fleets Can Fight Back
Cargo theft has shifted from parking-lot break-ins to organized international schemes using double brokering, phishing, and even spoofing tracking signals. In this HDT Talks Trucking video podcast episode, cargo-theft investigator Scott Cornell explains what’s changed and what fleets need to do now.
Read More →International Roadcheck 2026 to Target ELD Tampering and Cargo Securement
What fleets need to know about CVSA’s 72-hour inspection blitz and this year’s enforcement priorities.
Read More →FMCSA Proposes Extending State Emergency Exemptions to 30 Days
After pushback from states and industry groups, FMCSA is proposing to reverse a 2023 rule change and lengthen the duration of state-issued emergency exemptions for disaster relief.
Read More →Western Star Expands Recall After Previous Battery Fix Fails to Prevent Fire Risk
After reports of corrosion and thermal events on trucks already repaired under a prior campaign, DTNA is recalling nearly 27,000 Western Star 47X and 49X models to address a battery junction stud defect.
Read More →FMCSA Revokes Another Nine Electronic Logging Devices
Motor carriers using the affected ELDs must switch to paper logs immediately and install compliant devices by April 14 to avoid out-of-service violations.
Read More →FMCSA Locks in Non-Domiciled CDL Restrictions
After a legal pause last fall, FMCSA has finalized its rule limiting non-domiciled commercial driver's licenses. The agency says the change closes a safety gap, and its revised economic analysis suggests workforce effects will be more gradual than first thought.
Read More →",Metrolink,Unknown,Unknown,Mercury Transportation,Unknown,Unknown,Metrolink,Unknown,Unknown,Unknown,Unknown,Unknown,Unknown,Unknown,Unknown,AM,Unknown,Unknown,Los Angeles,CA,Unknown,Glendale,Unknown,Unknown,C,Unknown,Unknown,Unknown,Unknown,Unknown,Unknown,1,Unknown,1,Unknown,Unknown,Unknown,1,Unknown,1,Yes,1,Yes,"Carbon dioxide, quantity unknown",Unknown,Unknown,4,early Friday morning,Unknown,Unknown,3,Commuter Train,1,Main,Unknown,Unknown,Unknown,Unknown,Unknown,Unknown,Unknown,Unknown,Unknown,1,1,Unknown,warning gates,Unknown,Unknown,Unknown,Unknown,Unknown,Unknown,Unknown,Unknown,Unknown,1,Male,2,No,4,Stopped on crossing,Unknown,Unknown,Unknown,Unknown,Unknown,Unknown,3,was not injured,2,had gotten out of the cab,0,0,1500000,1,0,Unknown,Unknown,1,In a preliminary investigation,0,Unknown,No,No,Unknown,"A truck driver missed his turn and got stuck on railroad tracks near Los Angeles while attempting to retrace his steps. Shortly after warning gates came down, a Metrolink commuter train collided with the trapped oversized load, injuring seven people and destroying the $1.5 million unit.",Unknown,Unknown,Unknown
CBMiwgFBVV95cUxQVjdTVlhHOEpaRm81b0dmbzhZNTZkaXA0Xy0wei15ZlZUZHlVNzN0WVJnVl8xYXZUeDcwLVQzN1cxM2tGWlZPSlRxNFdBeFBHRjRtbkdwYU1HUktSRDVrbW9haEk5YjhWWHJJQ0k4Mk93RVJrM0lBSVBDTzJMMWNOY2p6SXI2cmh4NFJzUGNpSXNzRVRUZ2lJM3Z1ZUFHbFJrWVdldWxoWDRKS0lYTVJYTnhrMlhsdldwYmVNOVl1U3cyZw,https://www.cbsnews.com/losangeles/news/san-bernardino-colton-police-pursuit-stolen-vehicle-crash-train-tracks-mount-vernon/,2026-03-05 01:21:00,San Bernardino pursuit suspect crashes into train while fleeing from police - CBS News,tf_html,2026-03-05 01:21:00,"San Bernardino pursuit suspect crashes into train while fleeing from police
San Bernardino police officers were in pursuit of a stolen vehicle on Wednesday afternoon when the suspect drove onto some train tracks and collided with a train.
Officers began the chase after learning of a car that had been stolen out of Colton. It was detected by a San Bernardino Police Department helicopter that was flying overhead, thanks to the vehicle's LoJack GPS detection system.
When SBPD officers tried to pull the driver over, the driver fled, prompting the chase to begin. As the chase continued, the suspect turned onto the train tracks near Mount Vernon Avenue and continued driving until they collided with a train, police said.
After the collision, the suspect allegedly got out of the car and ran until they climbed on top of a pipe in the area, where they temporarily resisted arrest before being taken into custody, according to SBPD.
Aerial footage shows the truck just feet away from a railing over the Santa Ana River.
No further information was provided.",Unknown,Unknown,Unknown,Unknown,Unknown,Unknown,Unknown,Unknown,Unknown,Unknown,Unknown,Unknown,Unknown,Unknown,Unknown,PM,Unknown,Unknown,San Bernardino,CA,06,San Bernardino,Mount Vernon Avenue,Public,B,B,Unknown,Unknown,Unknown,Unknown,Unknown,3,3,Unknown,Unknown,Unknown,Unknown,2,Unknown,4,Unknown,4,Unknown,Unknown,Unknown,Unknown,2,Day,Unknown,Unknown,Unknown,Unknown,Unknown,Unknown,Unknown,Unknown,Unknown,Unknown,Unknown,Unknown,Unknown,Unknown,Unknown,Unknown,Unknown,Unknown,Unknown,Unknown,Unknown,Unknown,Unknown,Unknown,Unknown,Unknown,Unknown,Unknown,Unknown,Unknown,2,,5,5,Drove vehicle onto train tracks and continued driving until collision.,Unknown,Unknown,Unknown,Unknown,Unknown,3,"Uninjured, able to flee and resist arrest",1,"Yes, the suspect was driving the vehicle at the time of collision.",0,0,Unknown,1,Unknown,Unknown,Unknown,Unknown,Unknown,Unknown,Unknown,Yes,Yes,Aerial footage shows the truck just feet away from a railing over the Santa Ana River.,"San Bernardino police officers pursued a suspect in a stolen vehicle who drove onto train tracks and collided with a train. After the collision, the suspect fled on foot and temporarily resisted arrest before being taken into custody.",Unknown,Unknown,Unknown
CBMi4wFBVV95cUxNc2RfLTBKVjBKWER1M1NzTDM5UkZwdWZSUXBURVlpdjFrMUtJUWhiNDNneEVJeEF6TUZNWDROUWh1aFN1RmdqUTQ5UlNaWGNvS01fYV9DTVd0OXcwVWd2NVV0ZGx2R0tmRDRBOTRHVWRWOE1vNDVDQWtBRHBYMmMzVVFMOUZjUDZaM3RRaG0yUWJKNTlQQU51Skc1bldVT1JUZWNmR0VfbGRwTWlnb19GUjNCSUpURjNGNTA5OHV3bHNkQ3c5bWxsNlNFV0N6YlkweU4tUWUxSkU4SUNNQjRZUl9nOA,https://www.abc10.com/article/news/local/sacramento/union-pacific-train-collision-has-turned-fatal-in-florin/103-32dc8321-dbad-4382-8324-89820396df16,2026-03-07 01:13:00,Union Pacific train collision has turned fatal in Florin - ABC10,tf_html,2026-03-06 15:15:00,"FLORIN, Calif — A pedestrian was struck and killed by a Union Pacific train in the area of 8500 Tiogawoods Drive, according to California Highway Patrol South Sacramento.
The incident occurred at approximately 3:15 p.m., where an adult victim was pronounced dead on scene. The train crew was not hurt and are being offered support after the collision, according to Union Pacific.
Currently, the incident is being handled by CHP South Sacramento and Union Pacific Railroad. The list of current roads closed are:
Gerber Rd and French Rd
Gerber Rd and Reese Rd
Florin Rd and Frasinetti Rd
It is currently unclear when the roads will be reopened; CHP South Sac says to find alternate routes in the meantime.
Update, 3/6/2026 as of 6:16 PM: South Sacramento CHP has confirmed the roads are reopened for drivers.
California: New Plan Will Install Solar At No Cost If You Live In These Zip CodesFed up with rising energy costs? Savvy homeowners are taking advantage of this energy savings program
Undo
California: New Plan Will Install Solar At No Cost If You Live In These Zip CodesFed up with rising energy costs? Savvy homeowners are taking advantage of this energy savings program
Undo
California: New Plan Will Install Solar At No Cost If You Live In These Zip CodesFed up with rising energy costs? Savvy homeowners are taking advantage of this energy savings program
Undo
California: New Plan Will Install Solar At No Cost If You Live In These Zip CodesFed up with rising energy costs? Savvy homeowners are taking advantage of this energy savings program
Undo
California: New Plan Will Install Solar At No Cost If You Live In These Zip CodesFed up with rising energy costs? Savvy homeowners are taking advantage of this energy savings program
‘Do Not Sell or Share My Personal Information’ Notice
Like many content publishers, we provide online advertising services that use cookies and similar technologies to collect information about your device and online activity on our sites, apps and other online services. These services use this information to try to tailor the ads you see online to your interests. These are called interest-based ads. For more information about our collection, use and disclosure of your personal information when you visit our sites and apps, see our Privacy Policy.
Under certain state laws, including, but not limited to, the California Consumer Privacy Act, California Privacy Rights Act, and the Virginia Consumer Data Protection Act (collectively, “State Privacy Laws”), this collection and use of our users’ information for interest-based advertising purposes may constitute a “sale” of personal information to other parties. Certain State Privacy Laws require that we give you the ability to opt out of the sale or sharing of your personal information or data in connection with these targeting advertising activities. Although State Privacy Laws only extend their protections to residents of their particular states, we respect consumer choice when it comes to privacy rights. Accordingly, we offer all of our users – regardless of whether you are a resident of a state that has adopted a State Privacy Law – the right to opt out of this type of sale or sharing of your personal information. You can exercise this opt-out right by using the toggle switch below.
Opting out will not disable cookies or other technologies that facilitate the proper functioning of our website or collect data for purposes that do not involve targeted advertising. Opting out will not mean that you will stop seeing interest-based ads or other ads online. Specifically, opting out will not prevent you from seeing interest-based ads based on information that, for purposes of State Privacy Laws, was not sold or shared by us, was sold before you opted out, or was sold by third parties outside of our control. You can learn more about interest-based ads and additional opt-out choices here.
In addition, if you are a California resident and have enabled the Global Privacy Control (GPC) signal on a supported web browser, we will treat this as a request to opt-out of the sale or sharing of your personal information for targeted advertising purposes. For more information about what the GPC is and how to enable it, please visit globalprivacycontrol.org. More information
Manage Consent Preferences
Strictly Necessary Cookies
Always Active
These cookies are necessary for the website to function and cannot be switched off in our systems. They are usually only set in response to actions made by you which amount to a request for services, such as setting your privacy preferences, logging in or filling in forms. You can set your browser to block or alert you about these cookies, but some parts of the site will not then work. These cookies do not store any personally identifiable information.
Sale of Personal Data
Targeting Cookies
These cookies may be set through our site by our advertising partners. They may be used by those companies to build a profile of your interests and show you relevant adverts on other sites. They do not store directly personal information, but are based on uniquely identifying your browser and internet device. If you do not allow these cookies, you will experience less targeted advertising.
Performance Cookies
These cookies allow us to count visits and traffic sources so we can measure and improve the performance of our site. They help us to know which pages are the most and least popular and see how visitors move around the site. All information these cookies collect is aggregated and therefore anonymous. If you do not allow these cookies we will not know when you have visited our site, and will not be able to monitor its performance.",Union Pacific,Unknown,Unknown,Unknown,Unknown,Unknown,Union Pacific,Unknown,Unknown,Unknown,Unknown,3,6,2026,3:15,PM,Unknown,Unknown,Unknown,Calif,Unknown,Florin,Unknown,Unknown,K,Unknown,Unknown,Unknown,Unknown,Unknown,Unknown,Unknown,Unknown,1,1,Unknown,Unknown,1,1,4,Unknown,4,Unknown,Unknown,Unknown,Unknown,2,3:15 p.m.,Unknown,Unknown,1,Freight Train,1,Main,Unknown,Unknown,Unknown,Unknown,Unknown,Unknown,Unknown,Unknown,Unknown,Unknown,Unknown,Unknown,Unknown,Unknown,Unknown,Unknown,Unknown,Unknown,Unknown,Unknown,Unknown,Unknown,Unknown,Unknown,Unknown,Unknown,Unknown,Unknown,Unknown,Unknown,Unknown,Unknown,Unknown,Unknown,Unknown,Unknown,Unknown,Unknown,1,0,Unknown,0,0,0,Unknown,1,Yes,0,0,No,No,Unknown,"A pedestrian was struck and killed by a Union Pacific train around 3:15 p.m. in the area of 8500 Tiogawoods Drive, Florin, Calif. The adult victim was pronounced dead on scene, while the train crew was not hurt, and several roads were closed before reopening later that day.",Unknown,Unknown,3/6/2026
CBMiwgFBVV95cUxQVjdTVlhHOEpaRm81b0dmbzhZNTZkaXA0Xy0wei15ZlZUZHlVNzN0WVJnVl8xYXZUeDcwLVQzN1cxM2tGWlZPSlRxNFdBeFBHRjRtbkdwYU1HUktSRDVrbW9haEk5YjhWWHJJQ0k4Mk93RVJrM0lBSVBDTzJMMWNOY2p6SXI2cmh4NFJzUGNpSXNzRVRUZ2lJM3Z1ZUFHbFJrWVdldWxoWDRKS0lYTVJYTnhrMlhsdldwYmVNOVl1U3cyZ9IBxwFBVV95cUxPYkNTTXVWQzdqMjNJMnpoOUswaEwwelVKRk9XcjNINnhDTEFWanBkWF9mcGZlVURZSXJWNU5FZklXSURDY0F1eU9qcURkZ3dKb0paanphdDU3RHc0Y2RDVHhiejktNTFrRlctRTlzLWx4eUgySm1BMVhCV2tYdl81cEtFb0NqVXhUMTQwcFkyeU9hRlIwWnEwZ0NpeDlqWE9Cb1RvaWl2LVZXOS1rNm9lc0ZxS0tpWUkxM1dyaUZjY3NGQWtWemtZ,https://www.cbsnews.com/losangeles/news/san-bernardino-colton-police-pursuit-stolen-vehicle-crash-train-tracks-mount-vernon/,2026-03-05 01:21:00,San Bernardino pursuit suspect crashes into train while fleeing from police - CBS News,tf_html,2026-03-05 01:21:00,"San Bernardino pursuit suspect crashes into train while fleeing from police
San Bernardino police officers were in pursuit of a stolen vehicle on Wednesday afternoon when the suspect drove onto some train tracks and collided with a train.
Officers began the chase after learning of a car that had been stolen out of Colton. It was detected by a San Bernardino Police Department helicopter that was flying overhead, thanks to the vehicle's LoJack GPS detection system.
When SBPD officers tried to pull the driver over, the driver fled, prompting the chase to begin. As the chase continued, the suspect turned onto the train tracks near Mount Vernon Avenue and continued driving until they collided with a train, police said.
After the collision, the suspect allegedly got out of the car and ran until they climbed on top of a pipe in the area, where they temporarily resisted arrest before being taken into custody, according to SBPD.
Aerial footage shows the truck just feet away from a railing over the Santa Ana River.
No further information was provided.",Unknown,Unknown,Unknown,Unknown,Unknown,Unknown,Unknown,Unknown,Unknown,Unknown,Unknown,Unknown,Unknown,Unknown,Unknown,PM,Unknown,Unknown,San Bernardino,CA,Unknown,San Bernardino,Unknown,Unknown,B,TRUCK,Unknown,Unknown,Unknown,Unknown,Unknown,3,MOVING,Unknown,Unknown,Unknown,Unknown,2,2,4,Unknown,4,Unknown,Unknown,Unknown,Unknown,2,2,Unknown,Unknown,Unknown,Unknown,Unknown,Unknown,Unknown,Unknown,Unknown,Unknown,Unknown,Unknown,Unknown,Unknown,Unknown,Unknown,Unknown,Unknown,Unknown,Unknown,Unknown,Unknown,Unknown,Unknown,Unknown,Unknown,Unknown,Unknown,Unknown,Unknown,2,No,5,5,Drove onto and along train tracks,Unknown,Unknown,Unknown,Unknown,Unknown,3,Uninjured,1,Yes,0,0,Unknown,1,Unknown,Unknown,Unknown,Unknown,Unknown,Unknown,Unknown,Yes,Yes,Aerial footage shows the truck just feet away from a railing over the Santa Ana River.,"While fleeing from police in a stolen vehicle, the suspect drove onto train tracks and collided with a train. Following the collision, the suspect exited the vehicle and ran, temporarily resisting arrest before being taken into custody.",Unknown,Unknown,Unknown
CBMi3gFBVV95cUxQei0tclYxU2s4Q0RlTE1fNGN5NDlSa0NTeVZQQ2RrQkVNeXRYaFVrVV9Sb182em9HQXVDelVBeW40ZjdGcFZXSkpId28wOUk1VHhNWklhUkJzeE4xWGxYWG8wajBRTFJuNG1Feko0cHBPUHNNZDhUZ2FOYzBLdjJRWDVRRGZXUmxZZG9qVl9rNmFxZ0N2WlRWR1g1dDNBN1Y1a2tFaDgzWjNJZFJaclR3QXFZZGJxRDZkTklzTmRsX1BWN3NFeWVtaHpDa0RaMVV3T0l4QmQzS2RXazItTFE,https://www.facebook.com/accidentnews247/posts/los-angeles-ca-pedestrian-killed-in-train-accident-near-media-center-drive-in-gl/1246253801023182/,2026-03-12 22:18:41,"Los Angeles, CA – Pedestrian Killed in Train Accident near Media Center Drive in Glassell ParkAccording to the Los Angeles Fire Department, the incident was reported at around 11:30 a.m. March 11, in the area of 2705 Media Center Drive west of San Ferna - facebook.com",np_html,2026-03-11 11:30:00,"Los Angeles, CA – Pedestrian Killed in Train Accident near Media Center Drive in Glassell ParkAccording to the Los Angeles Fire Department, the incident was reported at around 11:30 a.m. March 11, in the area of 2705 Media Center Drive west of San Fernando Road

Los Angeles, CA – Authorities responded to an accident in which a pedestrian was hit and killed by a train in the Glassell Park neighborhood of Los Angeles on Wednesday morning.

According to the Los Angeles Fire Department, the incident was reported at around 11:30 a.m. March 11, in the area of 2705 Media Center Drive west of San Fernando Road.

Initial reports indicate that an Amtrak train hit a person on the tracks. It’s unclear why the victim was on the tracks when they were hit.

The Los Angeles Fire Department crews and Los Angeles Police Department officers arrived at the scene shortly after.

The medics confirmed the pedestrian’s death at the site of the collision. The victim’s name, age, and gender were not immediately released.

No one on the train reported any injuries as a result of the collision.

At this time, no additional details on the incident have been released. Investigations are ongoing to establish how and why the accident occurred.

https://www.lapdonline.org/ According to 2025 year-end data from the Los Angeles Police Department (), the city recorded 290 traffic fatalities, a slight 6% decrease from the 302 deaths reported in 2024. Despite this modest decline, the roads remain deadlier than pre-pandemic levels. Pedestrians remain the most vulnerable group, accounting for over 50% of all fatalities (150+ deaths in 2025), while severe injuries citywide have remained high, consistently exceeding 1,500 annually since 2022.",Amtrak,Unknown,Unknown,Unknown,Unknown,Unknown,Unknown,Unknown,Unknown,Unknown,Unknown,3,11,Unknown,11:30,AM,Unknown,Unknown,Los Angeles,CA,Unknown,Los Angeles,San Fernando Road,Public,K,Unknown,Unknown,Unknown,Unknown,Unknown,Unknown,Unknown,Unknown,1,Unknown,Amtrak train,Unknown,1,Unknown,4,Unknown,4,Unknown,Unknown,Unknown,Unknown,2,Day,Unknown,Unknown,2,Amtrak train,1,Main,Unknown,Unknown,Unknown,Unknown,Unknown,Unknown,Unknown,Unknown,Unknown,Unknown,Unknown,Unknown,Unknown,Unknown,Unknown,Unknown,Unknown,Unknown,Unknown,Unknown,Unknown,Unknown,Unknown,Unknown,Unknown,Unknown,Unknown,Unknown,Unknown,Unknown,Unknown,Unknown,Unknown,Unknown,3,Uninjured,1,Yes,Unknown,0,Unknown,Unknown,0,0,Unknown,1,Yes,0,0,No,No,Unknown,"A pedestrian was hit and killed by an Amtrak train in the Glassell Park neighborhood of Los Angeles near 2705 Media Center Drive on March 11 around 11:30 a.m. The victim's name, age, and gender were not immediately released, and investigations are ongoing to establish how and why the accident occurred.",Unknown,Unknown,Unknown
