news_id,url,pub_date,title,selected_crawler,accident_date,content,1,1a,1b,2,2a,2b,3,3a,3b,4_1,4_2,5_1,5_2,5_3,6_1,6_2,7,8,9,10_1,10_2,11,12_1,12_2,13_1,13_2,13_3,14_1,14_2,15_1,15_2,16_1,16_2,17_1,17_2,17_3,18,19_1,19_2,20a_1,20a_2,20b_1,20b_2,20c,21_1,21_2,22_1,22_2,23_1,23_2,24_1,24_2,25_1,25_2,26,27,28,29,30_1,30_2,30_3,31_1,31_2,32_1,32_2,32_3,33,34_1,34_2,35_1,35_2,36_1,36_2,37_1,37_2,38,39_1,39_2,40_1,40_2,41_1,41_2,41_3,42_1,42_2,43_1,43_2,43_3,44_1,44_2,45_1,45_2,46_1,46_2,47,48,49_1,49_2,50,51_1,51_2,52_1,52_2,53a_1,53a_2,53b,54,55,56,57
CBMirAFBVV95cUxQQ3dNVGhtMkFrZUlyQWZGRDk1UUNYdkRkd0xCdl9CMllWZlNMc3VWUkZLVE1OYWNGMVVBcWMyMjZVSDZ0UTgzZUw1NWxVREV1OVNuLWpNOFhIcmdLeHQzSUZKaFVCRDFfSE1feHBKaGtRX0dHR0hTZ19hRW9GZEVQdXh4WnQ5Mnppa05vUmlaVUdFQTR1UzN4bFc5THBPN2dvRE1zYmhWelhlYTJs,https://www.edhat.com/news/pedestrian-struck-and-killed-by-amtrak-train-near-milpas-street-in-santa-barbara/,2026-02-02 03:39:47,Pedestrian Struck and Killed by Amtrak Train Near Milpas Street in Santa Barbara - edhat,rd_html,2026-02-01 13:34:00,"On February 1, 2026, at approximately 1:34 pm, The Santa Barbara Police Communications Center received a 9-1-1 call regarding an AMTRAK train that struck at pedestrian on Milpas Street at the railroad tracks.
Santa Barbara Police, Santa Barbara Fire and AMR Paramedics responded to the emergency. The pedestrian had tragically succumbed to their injuries. 
Milpas St is currently closed and will remain closed until the investigation can be completed and the train can be safely moved.
The deceased adult male’s identity is being withheld pending the notification of their next of kin.
This is a tragic incident, and the Santa Barbara Police Department would like to remind everyone to please use extreme caution when you are crossing the railroad tracks and please abide by the warning signals at the railroad crossings.
The Santa Barbara County Coroner’s Office responded to the scene and took over the investigation.",AMTRAK,Unknown,Unknown,Unknown,Unknown,Unknown,Unknown,Unknown,Unknown,Unknown,Unknown,2,1,2026,1:34,PM,Unknown,Unknown,Santa Barbara County,CA,6,Santa Barbara,Milpas Street,Public,K,Unknown,Unknown,Unknown,Unknown,Unknown,Unknown,Unknown,Unknown,1,Unknown,Unknown,Unknown,1,Unknown,4,Unknown,4,Unknown,Unknown,Unknown,Unknown,2,Day,Unknown,Unknown,2,Passenger Train-Pulling,1,Main,Unknown,Unknown,Unknown,Unknown,Unknown,Unknown,Unknown,Unknown,Unknown,Unknown,Unknown,Unknown,Yes,Unknown,Unknown,Unknown,Unknown,Unknown,Unknown,Unknown,Unknown,Unknown,1,Male,3,Unknown,Unknown,Unknown,Unknown,Unknown,Unknown,Unknown,Unknown,Unknown,Unknown,Unknown,Unknown,Unknown,1,0,Unknown,Unknown,0,0,Unknown,Unknown,Unknown,0,0,No,No,Unknown,"On February 1, 2026, an AMTRAK train struck a pedestrian on Milpas Street at the railroad tracks in Santa Barbara. The pedestrian tragically died from their injuries, leading to the closure of Milpas Street for investigation.",Unknown,Unknown,Unknown
CBMinAFBVV95cUxPNzRGd0hyWjhlX2w3T1hDbk1kWHpyd1lrRzYtUkRSMlhhUnkxVmNZeVBSUHFJU2NjbDVuQlBFdWdIaUpsd1RlUDA2aEZwUG11OWpwX0tCTEgyT21WcTJZOGZoTl9FbkZRU05ZS3FvNmVYVVZVN3FEcUxHSncyelVUUFpQaF9kenhFczJlSEUzcmg2YmtsRThzamllMHk,https://padailypost.com/2026/02/09/community-urges-council-to-close-train-crossing-after-deaths/,2026-02-10 04:13:05,Community urges council to close train crossing after deaths - Palo Alto Daily Post,gs_html,2026-02-03 00:00:00,"Palo Alto community members are urging City Council to close the intersection where Churchill Avenue intersects with the railroad tracks after a Caltrain hit and killed 17-year-old Summer Devi Mehta last Tuesday.

In a letter to the City Council Nick Mehta, Summer’s father, said he supports closing the intersection, believing Churchill provided an “easy means for her to impulsively act at a low moment.”

The letter was read by a friend of Nick Mehta’s during tonight’s council meeting.

The Caltrain crossing at Churchill Avenue and Alma Street is adjacent to Palo Alto High School, and has been the site of multiple student suicides over the past few years.

“It is too late for my daughter but it is not too late for others,” Nick Mehta wrote.

In response, Mayor Vicki Veenker said tonight that an The Rail Safety/Youth Mental Health ad hoc committee has been created to look into ramping up safety measures at the intersection, and the logistics of shutting it down, an action that Palo Alto Unified School District Superintendent Don Austin urged the council to do in a Thursday letter.

The committee consists of council members Julie Lythcott-Haims, Pat Burt and Greer Stone.

Lythcott-Haims said the committee has already met with Caltrain and other city transportation safety officials to explore their options, which included talks about installing more high-tech cameras that can detect unusual movements on the tracks and paying security guards to monitor the intersection. The committee will meet again this week, Lythcott-Haims said.

But several residents said they also want council to shut the Churchill crossing immediately, and not wait for the committee’s insights and recommendation.

A resident who identified herself as Bre. T said her daughter was Summer’s friend and is “begging” the council to close the intersection.

“Failing to close is a complacency I just can’t tolerate as a mom anymore,” she said.

Prior to the ad hoc meeting, Caltrain and Palo Alto were working on installing new technologies at Churchill crossings to improve safety, including using AI to help detect and alert officials about lingering cars and pedestrians on the tracks. Other potential updates include a partial underpass to reduce car and pedestrian traffic and grade separation, which would require temporarily closing the crossing.",Caltrain,Unknown,Unknown,Unknown,Unknown,Unknown,Caltrain,Unknown,Unknown,Unknown,Unknown,Unknown,Unknown,Unknown,Unknown,Unknown,Palo Alto,Unknown,Unknown,Unknown,Unknown,Palo Alto,Churchill Avenue,Unknown,K,Unknown,Unknown,Unknown,Unknown,Unknown,Unknown,2,Unknown,1,Unknown,Unknown,Unknown,1,Unknown,4,Unknown,4,Unknown,Unknown,Unknown,Unknown,Unknown,Unknown,Unknown,Unknown,Unknown,Unknown,1,Main,Unknown,Unknown,Unknown,Unknown,Unknown,Unknown,Unknown,Unknown,Unknown,Unknown,Unknown,Unknown,Unknown,Unknown,Unknown,Unknown,Unknown,Unknown,Unknown,Unknown,Unknown,17,2,Female,2,No,8,Suicide/Attempted suicide,Unknown,Unknown,Unknown,Unknown,Unknown,Unknown,Unknown,Unknown,Unknown,Unknown,1,0,0,0,0,0,Unknown,Unknown,Unknown,0,0,No,No,The Rail Safety/Youth Mental Health ad hoc committee,A Caltrain hit and killed 17-year-old Summer Devi Mehta last Tuesday at the intersection of Churchill Avenue and the railroad tracks. This crossing is adjacent to Palo Alto High School and has been the site of multiple student suicides over the past few years.,Unknown,Unknown,Unknown
CBMijgFBVV95cUxPV1NrVmNzZEtVb0s2RmYweTlySlpqc3BzRm9qVW9yV2NLVW5oLTJHYUNiV1RqbkVxSXQ0Q0pnTkVUSTRfTVNScmxrTHcyaGNYWHdfRzJId2xtbnpiYmpPa3lsMWRXcmNpUjlfVWwyVkRlRGFjNjdSTHBtNDdVV09vVnVXaWxQVWhEb0x0UU53,https://www.newsline.com/news/breaking/jamaal-scott-train-pedestrian-archibald-avenue,2026-02-01 07:55:35,Jamaal Scott killed in train pedestrian crash near Archibald Avenue - newsline.com,tf_url,2026-01-25 10:49:00,"Pedestrian struck by train on tracks close to Airport Drive
January 25, 2026 | Ontario, CA
A 43-year-old pedestrian lost his life in a tragic train accident near Archibald Avenue and Airport Drive, as detailed in a press release from the San Bernardino County Sheriff's Department.
Jamaal Lionel Scott, 43, died at the scene after a train struck him near Archibald Avenue and Airport Drive in Ontario.
What Happened in the Crash?
Jamaal Lionel Scott was struck by a train at around 10:49 a.m. on Jan. 25. He was pronounced dead at the location by responding officials. The Ontario Police Department has launched an investigation into the circumstances surrounding the incident.
- Victim: Jamaal Lionel Scott, 43 years old
- Location: Intersection of Archibald Avenue and Airport Drive, Ontario, CA
- Time: Approximately 10:49 a.m.
- Date: Jan. 25
- Outcome: Fatal injury at the scene
- Investigating Agency: Ontario Police Department
Why Do Train-Pedestrian Accidents Occur?
Train-related collisions can stem from various factors, such as errors by train operators, track defects, mechanical issues, signaling mistakes, or unsafe pedestrian areas. Authorities will assess whether the crossing was properly secured during their review.
According to the National Transportation Safety Board (NTSB), roughly 1,000 individuals lose their lives annually in train accidents across the U.S.
Common Causes of Train Accidents |
Description |
Source |
|---|
Train Personnel Error |
Mistakes by engineers or crew |
NTSB |
Track Failure |
Structural defects in rails |
NTSB |
Mechanical Malfunction |
Issues with train equipment |
NTSB |
Signalman Error |
Faulty signaling operations |
NTSB |
Reckless Actions |
Unsafe behavior by pedestrians or drivers |
NTSB |
Inadequate Safety Measures |
Poorly marked or unsecured crossings |
Federal Railroad Administration |
Legal Insights
In cases such as this, conducting an independent review promptly is crucial to gather vital evidence for affected families. National legal analyst Candice Bond, managing partner of Bond Legal, emphasized the importance of such steps.
“A skilled attorney can protect a grieving family from powerful train companies, which often send their investigators to crash sites and possess a variety of resources they can utilize to defend a negligent party,” said Bond.
- Preserve evidence through professional analysis to counter corporate investigations.
- Families may pursue claims for loss of companionship, emotional distress, and other damages.
- Legal support ensures rights are safeguarded amid complex investigations.
Stefano Formica, of counsel with Bond Legal, highlighted the emotional toll of such tragedies.
“The stress and sorrow can be extremely overwhelming after losing a loved one in an accident,” said Formica. “We understand just what families are forced to go through, and having their rights protected is vital. A wrongful death lawyer will stay updated on the official investigation and help ensure that their legal rights and best interests are protected.”
Pending investigation outcomes, the family of Jamaal Scott could be eligible for a wrongful death claim to address the profound effects of the loss.
Newsline, the premier digital news platform owned by Belsito Communications, Inc., upholds rigorous editorial standards with an unwavering commitment to journalistic integrity and editorial excellence. For transparency, view our Corrections Policy, which guarantees a 24-hour review of any submitted corrections.
(This report is based on verified data - learn more on our About Us page.)
Newsline - is your trusted source for legal news and accident reports, delivering timely updates to keep you informed.
Candice Bond, national legal analyst for Newsline, has extensive experience with fatal pedestrian accidents. If you or a loved one needs help, she offers free consultations.
(Candice Bond, our national legal analyst, is a Managing Partner at Bond Legal. Newsline can and does use quotes from prior interviews with our analysts for our news articles. If you would like to contact Bond Legal to help you, please call 866-985-6515 or use the submission box found on this page. Legal analysts quoted may or may not be licensed in your state).",Unknown,Unknown,Unknown,Unknown,Unknown,Unknown,Unknown,Unknown,Unknown,Unknown,Unknown,1,25,2026,10:49,AM,Unknown,Unknown,San Bernardino,CA,Unknown,Ontario,Archibald Avenue and Airport Drive,Unknown,K,Unknown,Unknown,Unknown,Unknown,Unknown,Unknown,Unknown,Unknown,Unknown,Unknown,Unknown,Unknown,1,1,4,Unknown,4,Unknown,Unknown,Unknown,Unknown,2,Day,Unknown,Unknown,Unknown,Unknown,Unknown,Unknown,Unknown,Unknown,Unknown,Unknown,Unknown,Unknown,Unknown,Unknown,Unknown,Unknown,Unknown,Unknown,Unknown,Unknown,Unknown,Unknown,Unknown,Unknown,Unknown,Unknown,Unknown,43,1,Male,3,Unknown,Unknown,Unknown,Unknown,3,Unknown,Unknown,Unknown,Unknown,Unknown,Unknown,Unknown,Unknown,1,0,Unknown,Unknown,0,0,Unknown,Unknown,Unknown,0,0,No,No,"Independent review, professional analysis, official investigation","On January 25, 2026, a 43-year-old pedestrian named Jamaal Lionel Scott was fatally struck by a train near Archibald Avenue and Airport Drive in Ontario, CA, at approximately 10:49 a.m. He was pronounced dead at the scene, and the Ontario Police Department has initiated an investigation into the circumstances of the incident.","Candice Bond, National Legal Analyst for Newsline / Managing Partner, Bond Legal",Unknown,"Jan. 25, 2026"
CBMingFBVV95cUxNS25rQ3I1RmZ2SjE5TEFpeU05REs3am8weldrbTY3ZkRFWjV5R3pPRUMtUVpqdVRiYWxud0Zqd3RiNUpuYzJXZjd3Vzc4dmNVeFhvZHh3Slp3dEFzZUdMSEJFNDVBbno3TlpTTWNyell4U3M5QU5mbzJMWDNfYkEzZ2Z6SEpWYzRocDloZ05jRFBlTXZOdWxqLXdsNUhUUQ,https://www.thelegaladvocate.com/news/breaking/jose-calderon-union-pacific-south-cucamonga-avenue,2026-02-06 19:26:42,"Jose Calderon killed in pedestrian-train crash, authorities say - The Legal Advocate",tf_html,2026-02-04 08:48:00,"Struck by Union Pacific train on South Cucamonga Avenue
ONTARIO, CA, (February 04, 2026) - A 44-year-old man was tragically killed in a pedestrian-train accident Wednesday morning in Ontario.
Jose Calderon died after being struck by a Union Pacific train in the 200 block of South Cucamonga Avenue in San Bernardino County.
According to authorities, Ontario resident Jose Calderon was struck by a Union Pacific train at about 8:48 a.m. in the 200 block of South Cucamonga Avenue.
Calderon was pronounced deceased at the scene.
No additional details have been released.
FATAL PEDESTRIAN-TRAIN ACCIDENT INVESTIGATION
Train accidents such as this can occur for several reasons, including train personnel error, train track failure, a mechanical error or malfunction, a signalman error, and reckless actions.
According to the National Transportation Safety Bureau (NTSB), approximately 1,000 people are killed in train-related accidents each year. During the probe, investigators will also examine if the crash site was made safe for the pedestrian crossing.
Candice Bond, an experienced train accident attorney, said that in cases such as this that it is imperative to have an independent investigation conducted by a seasoned lawyer as soon as possible to preserve evidence for a victim's family.
“A skilled attorney can protect a grieving family from powerful train companies, which often send their investigators to crash sites and possess a variety of resources they can utilize to defend a negligent party,” said Bond, Managing Partner of Bond Legal and national analyst for The Legal Advocate.
WRONGFUL DEATH CLAIM
Pending results of the investigation, family members of Jose Calderon may be entitled to a wrongful death claim. Family members of wrongful death victims may seek damages for loss of love and companionship, pain, suffering and emotional distress following a catastrophic accident such as this incident.
“The stress and sorrow can be extremely overwhelming after losing a loved one in an accident,” said Stefano Formica, Of Counsel with Bond Legal. “We understand just what families are forced to go through, and having their rights protected is vital. A wrongful death lawyer will stay updated on the official investigation and help ensure that their legal rights and best interests are protected.”
(This report is based on verified data - learn more on our About Us page.)
If you or a family member have been involved in a situation similar to this article and would like to speak to our national legal analysts Candice Bond or Stefano Formica free of charge, please use the contact information found on this page.
(Candice Bond, Managing Partner, and Stefano Formica, Of Counsel, at Bond Legal, are the national legal analysts for The Legal Advocate. The Legal Advocate can and does use quotes from prior interviews with our analysts for our news articles. If you would like to contact Bond Legal to help you, please call 866-599-0297 or use the submission box found on this page. Legal analysts quoted may or may not be licensed in your state).
Tags: Latest News, Commercial, Pedestrian Accident, California, Fatal Crash, Train Accident, Union Pacific, Ontario, South Cucamonga Avenue, San Bernardino County",Union Pacific,Unknown,Unknown,Unknown,Unknown,Unknown,Union Pacific,Unknown,Unknown,Unknown,Unknown,2,4,2026,8:48,AM,Unknown,Unknown,San Bernardino County,CA,Unknown,Ontario,South Cucamonga Avenue,Public,K,Unknown,Unknown,Unknown,Unknown,Unknown,Unknown,Unknown,Unknown,1,Unknown,Unknown,Unknown,1,Unknown,4,Unknown,4,Unknown,Unknown,Unknown,Unknown,2,Day,Unknown,Unknown,1,Union Pacific train,1,Main,Unknown,Unknown,Unknown,Unknown,Unknown,Unknown,Unknown,Unknown,Unknown,Unknown,Unknown,Unknown,Unknown,Unknown,Unknown,Unknown,Unknown,Unknown,Unknown,Unknown,Unknown,44,1,Male,2,No,Unknown,Unknown,Unknown,Unknown,Unknown,Unknown,Unknown,Unknown,Unknown,Unknown,Unknown,Unknown,1,0,Unknown,Unknown,0,0,Unknown,1,"During the probe, investigators will also examine if the crash site was made safe for the pedestrian crossing. Candice Bond, an experienced train accident attorney, said that in cases such as this that it is imperative to have an independent investigation conducted by a seasoned lawyer as soon as possible to preserve evidence for a victim's family.",0,0,No,No,Unknown,"Jose Calderon, a 44-year-old Ontario resident, was tragically killed after being struck by a Union Pacific train around 8:48 a.m. on Wednesday, February 4, 2026, in the 200 block of South Cucamonga Avenue. He was pronounced deceased at the scene following this pedestrian-train accident in San Bernardino County.",Unknown,Unknown,"February 04, 2026"
CBMipwFBVV95cUxNdTNXbm9wUUNqdDlELTFzcVRQRkZWRzhjM2YwVkF1REJkaFJSR3d0V0dqZzZsMUhZbmpzOEtCSnIyTGMyc2ppYlJNbUhGc3lwSjZ5eFN3ckdIOEtfRGFJbXZUUThkZUVzTGJoMjNNckdjWTBvdnl6MWpHZ2xnSWR2bGlTX3o4NGNDOVJ6UGtGNERkSnNvcDB5b3ZpY2ZwckFkeld1OTRRUQ,https://www.thelegaladvocate.com/news/breaking/zukhra-kurbanova-fatal-train-crash-brazil-street-glendale,2026-02-06 05:51:35,"Zukhra Kurbanova killed in Glendale Metrolink train crash, police say - The Legal Advocate",tf_html,2026-02-04 09:00:00,"Two people, including a bystander, were transported to a hospital
GLENDALE, CA, (February 04, 2026) - The Glendale Police Department said a 35-year-old woman was killed in a crash with a downtown Los Angeles-bound Metrolink train along Brazil Street on Wednesday morning.
Zukhra Kurbanova, 35, was killed Wednesday morning when her vehicle was struck by a downtown Los Angeles-bound Metrolink train at a crossing in Glendale.
She was identified by the Los Angeles County Medical Examiner as Zukhra Kurbanova.
The crash occurred just west of the intersection of San Fernando Road and Broadway.
Kurbanova was driving a vehicle northbound on West San Fernando when she attempted to make a right turn onto Broadway around 9 a.m. and was struck by a Metrolink train traveling on the tracks. Tragically, she died at the scene from her injuries. The train was carrying roughly 150 passengers, three of whom were injured. One person was transported to a hospital. A bystander struck by debris from the crash was also hospitalized with non-life-threatening injuries.
Two trains, each on the Antelope Valley and San Bernardino lines, were canceled after the collision.
This is an ongoing investigation.
CRASH INVESTIGATION NEEDED
Train accidents such as this can occur for several reasons, including train personnel error, train track failure, a mechanical error or malfunction, a signalman error, and reckless actions.
Each year, train-related crashes claim hundreds of lives across the United States. Many of these fatalities result from poorly marked crossings, malfunctioning signals and inadequate fencing. Railroad deaths totaled 954 in 2024, a 1% decrease from the 2023 revised total of 967, the National Safety Council said in a report. During the probe, investigators will also examine if the crash site was made safe for the crossing.
Candice Bond, who specializes in train-related crashes, said that in cases such as this, it is imperative to have an independent investigation conducted by a seasoned lawyer as soon as possible to preserve evidence for a victim's family.
“A skilled attorney can protect a grieving family from powerful train companies, which often send their investigators to crash sites and possess a variety of resources they can utilize to defend a negligent party,” said Bond, Managing Partner of Bond Legal.
WRONGFUL DEATH CLAIM
Pending the investigation, the family members of Zukhra Kurbanova may be entitled to a wrongful death claim. Family members of wrongful death victims may seek damages for loss of companionship, pain, suffering, and emotional distress following a catastrophic accident such as this incident.
“The stress and sorrow can be extremely overwhelming after losing a loved one in an accident,” said Stefano Formica, Of Counsel with Bond Legal.
“We understand just what families are forced to go through, and having their rights protected is vital. A wrongful death lawyer will stay updated on the official investigation and help ensure that their legal rights and best interests are protected.”
(This report is based on verified data - learn more on our About Us page.)
Have you been in a similar accident and need help? Speak to one of The Legal Advocate's national legal analysts now free of charge for a no-obligation.
(Candice Bond, Managing Partner, and Stefano Formica, Of Counsel, at Bond Legal, are the national legal analysts for The Legal Advocate. The Legal Advocate can and does use quotes from prior interviews with our analysts for our news articles. If you would like to contact Bond Legal to help you, please call 866-599-0297 or use the submission box found on this page. Legal analysts quoted may or may not be licensed in your state).",Metrolink,Unknown,Unknown,Unknown,Unknown,Unknown,Unknown,Unknown,Unknown,Unknown,Unknown,2,4,2026,9:00,AM,Unknown,Unknown,Los Angeles County,CA,Unknown,Glendale,Brazil Street,Public,A,Auto,Unknown,Unknown,Unknown,1,North,3,Moving over crossing,1,1,Unknown,Unknown,1,1,Unknown,Unknown,Unknown,Unknown,Unknown,Unknown,Unknown,2,Day,Unknown,Unknown,3,Commuter Train-Pulling,1,Main,Unknown,Unknown,Unknown,Unknown,Unknown,Unknown,Unknown,Unknown,Unknown,Unknown,Unknown,Unknown,Unknown,Unknown,Unknown,Unknown,Unknown,Unknown,Unknown,Unknown,Unknown,35,2,Female,2,No,3,Did not stop,Unknown,3,Unknown,Unknown,Unknown,Unknown,1,Killed,1,Yes,1,1,Unknown,1,0,0,Unknown,1,Yes,0,3,No,No,Unknown,"Zukhra Kurbanova, 35, was killed on Wednesday morning when her vehicle was struck by a downtown Los Angeles-bound Metrolink train in Glendale while she attempted a right turn. The collision resulted in injuries to three train passengers and a bystander, who were all transported to a hospital.","Candice Bond, Managing Partner",Unknown,"February 04, 2026"
