news_id,url,pub_date,title,selected_crawler,accident_date,content,1,1a,1b,2,2a,2b,3,3a,3b,4_1,4_2,5_1,5_2,5_3,6_1,6_2,7,8,9,10_1,10_2,11,12_1,12_2,13_1,13_2,13_3,14_1,14_2,15_1,15_2,16_1,16_2,17_1,17_2,17_3,18,19_1,19_2,20a_1,20a_2,20b_1,20b_2,20c,21_1,21_2,22_1,22_2,23_1,23_2,24_1,24_2,25_1,25_2,26,27,28,29,30_1,30_2,30_3,31_1,31_2,32_1,32_2,32_3,33,34_1,34_2,35_1,35_2,36_1,36_2,37_1,37_2,38,39_1,39_2,40_1,40_2,41_1,41_2,41_3,42_1,42_2,43_1,43_2,43_3,44_1,44_2,45_1,45_2,46_1,46_2,47,48,49_1,49_2,50,51_1,51_2,52_1,52_2,53a_1,53a_2,53b,54,55,56,57
CBMioAFBVV95cUxOVHAyX3ZZQ2k5OXh4eUg5aV9kckJ1X1lEcjZlZHhKNUwxQWtoSkJ6Z0FBNzJUeVBFUl9xNDY0ZEM4VDBmczdoUC1QUHY2Z2s4c25tS0lpdzVyR0dTdEpnblp2Qi1NMFp4QWN1NUpzbVVqdWhfYXVHY3hSZnEtZmNwTzhHRy1EaktWOXhVbWVhV19LdUlMVHdfQXl3OXBfUkhW,https://bakersfieldnow.com/news/local/coroner-identifies-40-year-old-man-killed-by-train-in-shafter,2026-01-23 22:48:22,Coroner identifies 40-year-old man killed by train in Shafter - bakersfieldnow.com,rd_html,2026-01-17 09:34:00,"BAKERSFIELD, Calif. (KBAK/KBFX) — The Kern County Coroner’s Office has identified a man who died after being struck by a train in Shafter on Saturday as 40-year-old Gerardo Becerra Perez.The report said on January 17, 2026, at around 9:34 a.m., Perez was found dead after being hit by a train on South Beech Avenue and East Los Angeles Avenue in Shafter.The report said he died at the scene.",Unknown,Unknown,Unknown,Unknown,Unknown,Unknown,Unknown,Unknown,Unknown,Unknown,Unknown,1,17,2026,9:34,AM,Unknown,Unknown,Kern County,CA,6,Shafter,South Beech Avenue and East Los Angeles Avenue,Public,K,Unknown,Unknown,Unknown,Unknown,Unknown,Unknown,Unknown,Unknown,1,Unknown,Unknown,Unknown,1,Unknown,4,Unknown,4,Unknown,Unknown,Unknown,Unknown,2,Day,Unknown,Unknown,Unknown,Unknown,Unknown,Unknown,Unknown,Unknown,Unknown,Unknown,Unknown,Unknown,Unknown,Unknown,Unknown,Unknown,Unknown,Unknown,Unknown,Unknown,Unknown,Unknown,Unknown,Unknown,Unknown,Unknown,Unknown,40,1,Male,3,Unknown,5,Other (specify),Unknown,3,Unknown,7,Other (specify),Unknown,Unknown,Unknown,Unknown,Unknown,1,0,0,0,0,0,Unknown,Unknown,Unknown,0,0,No,No,Unknown,"On January 17, 2026, at approximately 9:34 a.m., 40-year-old Gerardo Becerra Perez was struck and killed by a train in Shafter near South Beech Avenue and East Los Angeles Avenue. He was found dead at the scene.",Unknown,Unknown,"January 17, 2026"
CBMilgFBVV95cUxOM1ZEa1NBemtLUnJjQU9NeFpZZ1ZKZV9WYTMxZUlkNkJNV2dWX1M4X1ZNWk5jUUhBMEhmdWotcnRCcS1JbDV5QUoxQUNKVUlvY0FGdTZ3Sjg4SUh4TUlDTDBwaGNocm1uZVo1ekpjZGRTS2VZNmkyZmxQUHFvczJQWUFKR1F3ak0wc0hQdy0xNUVLdnlKNFE,https://www.accidentinjurynews.com/breaking-news/train-strikes-kills-gerardo-perez-shafter/,2026-01-25 19:58:35,"Train Strikes and Kills Gerardo Perez in Shafter, Authorities Say - Accident Injury News",gs_html,2026-01-17 09:34:00,"Train Strikes and Kills Gerardo Perez in Shafter, Authorities Say

SHAFTER, CA — January 17, 2026 — A 40-year-old man was killed Saturday morning after being struck by a train in Shafter, according to authorities. The Kern County Coroner’s Office identified the victim as Gerardo Becerra Perez, a resident of Shafter. Law enforcement officials said Perez was hit by a train near the intersection of South Beech Avenue and East Los Angeles Avenue. Officers responded to the scene at approximately 9:34 a.m., where Perez was pronounced dead. The circumstances leading up to the collision were not immediately released, and the incident remains under investigation.



 Each year, hundreds of lives are lost in train-related incidents across the United States, many occurring at crossings with limited warning signs, faulty signals, or inadequate fencing. According to the National Safety Council, railroad fatalities reached 954 in 2024, reflecting a 1% decrease from the revised 2023 total of 967. Candice Bond, a seasoned train accident attorney, emphasized the importance of conducting an independent investigation promptly following a fatal crash to help preserve critical evidence for a victim’s family. “An experienced attorney can help shield grieving families from large railroad companies, which often deploy their own investigative teams and have extensive resources to defend against claims,” said Bond, Managing Partner of Bond Legal. “Acting quickly is crucial in these cases to ensure that all evidence is properly examined,” Bond added. 

 Pending the outcome of the investigation, surviving family members of Gerardo Becerra Perez may have the right to pursue a wrongful death claim. In such cases, families may seek compensation for loss of companionship, emotional distress, and the pain and suffering caused by the sudden loss of a loved one. “The emotional toll following the unexpected death of a family member can be devastating,” said Stefano Formica, Of Counsel with Bond Legal. “A wrongful death attorney can closely monitor the investigation while working to protect the legal rights and interests of the victim’s family,” Formica said.",Unknown,Unknown,Unknown,Unknown,Unknown,Unknown,Unknown,Unknown,Unknown,Unknown,Unknown,1,17,2026,9:34,AM,Unknown,Unknown,Kern County,CA,Unknown,Shafter,Unknown,Unknown,K,K,Unknown,Unknown,Unknown,Unknown,Unknown,Unknown,Unknown,1,Unknown,Unknown,Unknown,1,Unknown,4,Unknown,4,Unknown,Unknown,Unknown,Unknown,2,Day,Unknown,Unknown,Unknown,Unknown,Unknown,Unknown,Unknown,Unknown,Unknown,Unknown,Unknown,Unknown,Unknown,Unknown,Unknown,Unknown,Unknown,Unknown,Unknown,Unknown,Unknown,Unknown,Unknown,Unknown,Unknown,Unknown,Unknown,40,1,Male,3,Unknown,Unknown,Unknown,Unknown,3,Unknown,Unknown,Unknown,Unknown,1,Killed,2,"The text only states he was ""struck by a train"" and does not mention him being in a vehicle or driving one.",1,0,Unknown,Unknown,0,0,Unknown,1,The incident remains under investigation.,0,0,No,No,Unknown,"Gerardo Becerra Perez, a 40-year-old Shafter resident, was struck and killed by a train on Saturday morning, January 17, 2026, near the intersection of South Beech Avenue and East Los Angeles Avenue in Shafter, CA. Authorities responded at approximately 9:34 a.m., where he was pronounced dead, and the incident remains under investigation with the circumstances leading up to the collision not yet released.",Unknown,Unknown,"January 17, 2026"
CBMiiAFBVV95cUxOcWplUk5OSkc1ZkJkWXZyUmp5ajBKcEREY01lb3RTaVdiMzRKcC1SaktDRlk4V3prZVZwRjBzbTl6ZllZTEMwMnBMejgtWXZBR194ZXJZZVNxSmxQak4xc3lyZ1BsU1BNLVkxaGJKSkQzSXhFWGJFVWY3SlUtdWFvOXNlU2hFcVhT,https://www.vvng.com/train-collides-with-suv-in-hesperia-driver-escapes-unharmed/,2026-01-26 05:16:15,Train Collides with SUV in Hesperia; Driver Escapes Unharmed - vvng.com,tf_html,2026-01-25 18:13:00,"HESPERIA, Calif. (VVNG.com) — A train struck an SUV Sunday evening in Hesperia, but the driver was able to escape moments before impact.
The incident was reported at approximately 6:13 p.m. on January 25, 2026, near the intersection of W. Santa Fe Avenue and Deodar Street.
A white SUV became disabled on the tracks and was struck by a BNSF freight train hauling tanker cars.
Emergency crews responded to the scene and determined that no injuries occurred as a result of the crash.
According to preliminary information, the driver of the SUV managed to exit the vehicle before it was hit.
It is believed the driver may have fallen asleep prior to the collision. Drugs or alcohol are not suspected to be factors in the incident.
Train traffic was temporarily halted while crews worked to remove the damaged vehicle from the tracks.
The investigation is being handled by BNSF Police, and no further details have been released.
Copyright 2025 Victor Valley News Inc. All rights reserved. This material may not be published, broadcast, rewritten, or redistributed.
Note to readers: If you value our reporting and want to see it continue, consider becoming a monthly supporter. Your contribution helps keep independent, local news accessible to everyone. Support local news today!",BNSF,BNSF,Unknown,Unknown,Unknown,Unknown,BNSF,BNSF,Unknown,Unknown,Unknown,1,25,2026,6:13,PM,Unknown,Unknown,Unknown,CA,06,Hesperia,W. Santa Fe Avenue and Deodar Street,Public,A,Unknown,SUV,Unknown,Unknown,Unknown,Unknown,1,Unknown,1,Unknown,Unknown,Unknown,1,Unknown,2,The BNSF freight train was hauling tanker cars.,4,No hazardous materials release was reported.,,Unknown,Unknown,4,Dark,Unknown,Unknown,1,BNSF freight train hauling tanker cars,1,Main,Unknown,Unknown,Unknown,Unknown,Unknown,Unknown,Unknown,Unknown,Unknown,Unknown,Unknown,Unknown,Unknown,Unknown,Unknown,Unknown,Unknown,3,Unknown,3,Unknown,Unknown,Unknown,Unknown,2,2,4,4,Unknown,2,2,Unknown,Unknown,Unknown,3,Uninjured,2,"No, the driver exited moments before impact.",0,0,Unknown,1,0,0,Unknown,Unknown,Unknown,0,0,No,No,Unknown,"A white SUV became disabled on train tracks in Hesperia and was subsequently struck by a BNSF freight train hauling tanker cars. The driver managed to escape moments before impact, sustaining no injuries, and investigators believe falling asleep may have been a factor.",Unknown,Unknown,Unknown
CBMimgFBVV95cUxNQ0RkYU9YMEFUSTZ3TS1ucEc5eHNnN0J5dkFPUlJQalJqRWJkTkJnRmp0UFZwTEZYMmlZWGs2cGI3VktaZzRhLXhySlAydmFGZGlscHNkbU5sVXVNcmNlbnpNSUhiNWpIVDkxbnZOcjNLODY4QU0xOVY4UXo1MUNpejg1M3NNNWg4VUVVekloSFBXdW9wOEhNaHJB,https://localaccidentreports.com/ontario-ca-fatal-train-crash-at-e-airport-dr-n-archibald-ave/,2026-01-26 00:10:33,"Ontario, CA – Fatal Train Crash at E Airport Dr & N Archibald Ave - localaccidentreports.com",gs_html,2026-01-24 11:25:00,"Ontario, CA (January 25, 2026) – A deadly incident occurred late Saturday morning involving a train and a pedestrian near the intersection of East Airport Drive and North Archibald Avenue in the city of Ontario. Authorities responded to the scene shortly after 11:25 a.m. on January 24 following reports of a person struck on the tracks.

According to dispatch records, a Union Pacific train was involved in the fatal collision, which occurred within the jurisdiction of the California Highway Patrol’s Inland Division. The pedestrian, identified only as a trespasser at this time, was pronounced deceased at the scene. Responding officers requested the San Bernardino County Coroner’s Office shortly after confirming the fatality.

Officials have not released the identity of the victim, and it remains unclear how the individual came to be on the tracks. There is currently no estimated time for coroner arrival, and the area was temporarily held for investigation and scene management.

This tragic event remains under active investigation. Union Pacific and local law enforcement are working to determine the circumstances that led to the fatal encounter.

Our hearts go out to the family and loved ones of the individual who lost their life in this tragic incident.",Union Pacific,Unknown,Unknown,Unknown,Unknown,Unknown,Union Pacific,Unknown,Unknown,Unknown,Unknown,01,24,2026,11:25,AM,Unknown,Unknown,San Bernardino,CA,Unknown,Ontario,East Airport Drive and North Archibald Avenue,Public,K,Unknown,Unknown,Unknown,Unknown,Unknown,Unknown,Unknown,Unknown,1,1,Unknown,Unknown,1,1,4,Unknown,4,Unknown,Unknown,Unknown,Unknown,2,Unknown,Unknown,Unknown,1,Freight Train,1,Main,Unknown,Unknown,Unknown,Unknown,Unknown,Unknown,Unknown,Unknown,Unknown,Unknown,Unknown,Unknown,Unknown,Unknown,Unknown,Unknown,Unknown,Unknown,Unknown,Unknown,Unknown,Unknown,Unknown,Unknown,3,Unknown,Unknown,Unknown,Unknown,3,Unknown,Unknown,Unknown,Unknown,Unknown,Unknown,Unknown,Unknown,1,0,Unknown,Unknown,0,0,Unknown,1,Yes,0,0,No,No,Unknown,"A Union Pacific train fatally struck a pedestrian identified as a trespasser near the intersection of East Airport Drive and North Archibald Avenue in Ontario, CA, on January 24, 2026, shortly after 11:25 a.m. The individual was pronounced deceased at the scene, and the incident remains under active investigation by Union Pacific and local law enforcement.",Unknown,Unknown,"January 25, 2026"
CBMiswFBVV95cUxQNEFKUmszM3JQME1ZZzZQamhuOUdzc25PMDNBUUp1dmtBWVFpamZfY2hQcmtXcVh2ZVgwVWdrbkl6SEhWaEEzQW1BLUMtTGJmck5ZTFpBQktna25XdFc2WmFlVmxIR29telg1M2Uwekc1cEpPNDlnYjlyNG1EajBIeExkamp6Q1dTSjJ4TnJ3THZjUURnQUFsX196cG8waEhFQ2ppOFY3NjhMeVhDei1EQ2RBcw,https://www.thelegaladvocate.com/news/breaking/jamaal-scott-fatal-train-pedestrian-crash-ontario-archibald-avenue,2026-01-28 22:05:53,"Jamaal Scott dies in Ontario train accident, coroner says - The Legal Advocate",tf_html,2026-01-25 10:49:00,"Pedestrian fatally hit by train near Archibald Avenue and Airport Drive
ONTARIO, CA, (January 25, 2026) - A 43-year-old man tragically died Sunday morning in a train vs. pedestrian accident in Ontario, according to a coroner's press release from the San Bernardino County Sheriff's Department.
Jamaal Scott died Sunday morning in a train vs. pedestrian accident near Archibald Avenue and Airport Drive in Ontario.
The report says Jamaal Lionel Scott was hit by a train near Archibald Avenue and Airport Drive at approximately 10:49 a.m.
Sadly, Scott was declared dead at the scene.
Additional details were not initially released.
The Ontario Police Department is investigating.
FATAL PEDESTRIAN TRAIN ACCIDENT INVESTIGATION
Train accidents such as this can occur for several reasons, including train personnel error, train track failure, a mechanical error or malfunction, a signalman error, and reckless actions. During the probe, investigators will also examine if the crash site was made safe for the pedestrian crossing.
According to the National Transportation Safety Bureau (NTSB), approximately 1,000 people are killed in train-related accidents each year.
Candice Bond, an experienced train accident attorney, said that in cases such as this that it is imperative to have an independent investigation conducted by a seasoned lawyer as soon as possible to preserve evidence for a victim's family.
“A skilled attorney can protect a grieving family from powerful train companies, which often send their investigators to crash sites and possess a variety of resources they can utilize to defend a negligent party,” said Bond, Managing Partner of Bond Legal and national analyst for The Legal Advocate.
WRONGFUL DEATH CLAIM
Pending results of the investigation, the family of Jamaal Scott may be entitled to a wrongful death claim. Family members of wrongful death victims may seek damages for loss of love and companionship, pain, suffering and emotional distress following a catastrophic accident such as this incident.
“The stress and sorrow can be extremely overwhelming after losing a loved one in an accident,” said Stefano Formica, Of Counsel with Bond Legal. “We understand just what families are forced to go through, and having their rights protected is vital. A wrongful death lawyer will stay updated on the official investigation and help ensure that their legal rights and best interests are protected.”
(This report is based on verified data - learn more on our About Us page.)
The Legal Advocate's national legal analysts Candice Bond and Stefano Formica are experienced in fatal pedestrian accidents, and if you or a family member need help they are available for a free consultation to guide you.
(Candice Bond, Managing Partner, and Stefano Formica, Of Counsel, at Bond Legal, are the national legal analysts for The Legal Advocate. The Legal Advocate can and does use quotes from prior interviews with our analysts for our news articles. If you would like to contact Bond Legal to help you, please call 866-599-0297 or use the submission box found on this page. Legal analysts quoted may or may not be licensed in your state).
Tags: Latest News, Commercial, Pedestrian Accident, California, San Bernardino County, Ontario, Fatal Accident, Train Accident",Unknown,Unknown,Unknown,Unknown,Unknown,Unknown,Unknown,Unknown,Unknown,Unknown,Unknown,1,25,2026,10:49,AM,Unknown,Unknown,San Bernardino,CA,Unknown,Ontario,Unknown,Unknown,K,Unknown,Unknown,Unknown,Unknown,Unknown,Unknown,Unknown,Unknown,1,Unknown,Unknown,Unknown,1,Unknown,4,Unknown,4,Unknown,Unknown,Unknown,Unknown,2,Day,Unknown,Unknown,Unknown,Unknown,Unknown,Unknown,Unknown,Unknown,Unknown,Unknown,Unknown,Unknown,Unknown,Unknown,Unknown,Unknown,Unknown,Unknown,Unknown,Unknown,Unknown,Unknown,Unknown,Unknown,Unknown,Unknown,Unknown,43,1,Male,3,Unknown,Unknown,Unknown,Unknown,3,Unknown,Unknown,Unknown,Unknown,Unknown,Unknown,Unknown,Unknown,1,0,0,0,0,0,Unknown,1,Yes,0,0,No,No,Unknown,"A 43-year-old man, Jamaal Scott, died on Sunday morning, January 25, 2026, after being hit by a train near Archibald Avenue and Airport Drive in Ontario, CA. He was pronounced dead at the scene, and the Ontario Police Department is currently investigating the fatal accident.","Candice Bond, Managing Partner / National Legal Analyst; Stefano Formica, Of Counsel / National Legal Analyst",Unknown,"January 25, 2026"
CBMingFBVV95cUxPSjBTZjFQQXp6eGVnNGlvUlZIRktKUWVBSjF4M1lmLUZwcmNpem1mNXdqOEZuQWlZY29CNUdBTWhzUG1ycGRYRlNmalFWb2Izc3M5QTV6UVduTmh6RmxfQnRLRTlHdkVnZ0tXQWNGNGFtRkxRclJodlVVUG9mZGtRWmp6bklueG9uVDlFek0xd2FLcExmR05UdEJnOTlYdw,https://www.accidentinjurynews.com/breaking-news/pedestrian-jamaal-scott-struck-train-ontario-ca/,2026-01-29 09:01:16,"Pedestrian Jamaal Scott Fatally Struck by Train in Ontario, CA - Accident Injury News",np_html,2026-01-25 10:49:00,"The coroner identified the victim as 43-year-old Jamaal Lionel Scott. Authorities said the incident occurred near Archibald Avenue and Airport Drive at approximately 10:49 a.m. Scott was pronounced dead at the scene. The Ontario Police Department is investigating the crash.

ONTARIO, CA, January 25, 2026 — A man was fatally struck by a train Sunday morning in Ontario, according to a press release from the San Bernardino County Sheriff’s Department.

FATAL PEDESTRIAN TRAIN ACCIDENT INVESTIGATION

Train-pedestrian accidents can occur for a variety of reasons, including operator error, track defects, mechanical failures, signal system issues, or reckless conduct. As part of the investigation, authorities will also assess whether the area was properly secured and safe for pedestrian crossing.

The National Transportation Safety Bureau (NTSB) reports that roughly 1,000 fatalities occur each year in train-related incidents across the United States. In cases like this, Candice Bond, an experienced train accident attorney, emphasized the importance of initiating an independent investigation as early as possible to help preserve critical evidence for a victim’s family.

“An experienced attorney can help shield grieving families from large rail companies, which often dispatch their own investigators to accident scenes and have significant resources to defend against liability claims,” said Bond, Managing Partner of Bond Legal and national analyst for Accident Injury News.

WRONGFUL DEATH CLAIM

Depending on the outcome of the investigation, the family of Jamaal Scott may be eligible to pursue a wrongful death claim. Such claims may allow surviving relatives to seek compensation for loss of companionship, emotional distress, pain, and suffering resulting from a fatal accident.

“The emotional burden following the sudden loss of a loved one can be immense,” said Stefano Formica, Of Counsel with Bond Legal. “Families facing these tragedies deserve to have their rights protected. A wrongful death attorney can monitor the official investigation and work to ensure that a family’s legal interests are fully safeguarded during this difficult time.”",Unknown,Unknown,Unknown,Unknown,Unknown,Unknown,Unknown,Unknown,Unknown,Unknown,Unknown,1,25,2026,10:49,AM,Unknown,Unknown,San Bernardino,CA,Unknown,Ontario,Unknown,Unknown,M,Train,Train,Unknown,Unknown,Unknown,Unknown,Unknown,Unknown,Unknown,Unknown,Unknown,Unknown,1,1,4,Unknown,4,Unknown,Unknown,Unknown,Unknown,2,Day,Unknown,Unknown,Unknown,Unknown,Unknown,Unknown,Unknown,Unknown,Unknown,Unknown,Unknown,Unknown,Unknown,Unknown,Unknown,Unknown,Unknown,Unknown,Unknown,Unknown,Unknown,Unknown,Unknown,Unknown,Unknown,Unknown,Unknown,43,1,Male,3,Unknown,Unknown,Unknown,Unknown,3,Unknown,Unknown,Unknown,Unknown,Unknown,Unknown,Unknown,Unknown,1,0,Unknown,Unknown,0,0,Unknown,1,Yes,0,0,No,No,Unknown,"On Sunday, January 25, 2026, at approximately 10:49 a.m., 43-year-old Jamaal Lionel Scott was fatally struck by a train near Archibald Avenue and Airport Drive in Ontario, CA. He was pronounced dead at the scene, and the Ontario Police Department is investigating the crash.","Candice Bond, Managing Partner of Bond Legal and national analyst for Accident Injury News",Unknown,"January 25, 2026"
CBMijgFBVV95cUxOeTJmQUptSXFFYWtTeW01QTFBdEpGMzdNY1Voa25vWUxoSGU4Z0ozRU9DckZYU0JBb285VTE3MDh0WlVJRDEyZ1ZHN2Y0WE9DWlNSajNHaVlkNDhjYlBsNTVqLWVmUzRiQk9XWHBLUjlaaWZFRS1nVkFJdVVJV09pbjBkWlMtSDRYeGhxY1NB0gGTAUFVX3lxTE1nQW1wYXl5ZkcyaUR3dFZhWFJoSl90ZW1OLU5lY0xjSW9yQUEtazhZWnhUQnFFUER1c0ppMGtteEtsZ1pTWnVQUElEQ1d0YjVCNTlzS1FQck5IdGo1anE2RHFHOWl6dDRleWoxTkRlZXpETFBFMTF6TnpNc2wtTmViLVA1aDluNlgwd3kybWVaN181RQ,https://abc7.com/post/1-killed-crash-involving-metrolink-train-car-glendale/18542151/,2026-02-04 19:15:54,Pregnant woman killed in crash involving Metrolink train and car in Glendale - ABC7 Los Angeles,np_html,2026-02-04 09:00:00,"Pregnant woman killed in crash involving Metrolink train and car in Glendale

GLENDALE, Calif. (KABC) -- A pregnant woman was killed Wednesday morning in a violent collision involving a Metrolink train and a car at a crossing in Glendale.

The crash was reported shortly after 9 a.m. on Brazil Street, just west of the intersection of San Fernando Road and Broadway, between the Burbank Downtown and the Glendale stations, according to Metrolink.

The victim was pronounced dead at the scene.

According to the Glendale Police Department, the sedan was traveling northbound on West San Fernando Road when the driver attempted to make a right turn onto Broadway, which turns into Brazil Street at that point.

""As the vehicle entered the crossing, it was struck by a Metrolink train traveling on the tracks,"" police said in a statement.

The downtown L.A.-bound train, number 206 on the Antelope Valley Line, was stopped on the tracks for hours after the collision.

A male pedestrian who was in the immediate area was struck by an object as a result of debris from the collision, police said. He was transported to a local hospital with non-life-threatening injuries.

""There are approximately 150 passengers on train 206, though no injuries have been reported aboard at this time,"" Metrolink said in a statement issued shortly after 10 a.m.

Trains 207 and 208 on the Antelope Valley Line were canceled, as were trains 320 and 341 on the San Bernardino Line. Metro buses were used to shuttle passengers between the Burbank Downtown and Glendale stations.

The Glendale Police Department was leading the investigation.

City News Service contributed to this report.",Metrolink,Unknown,Unknown,Unknown,Unknown,Unknown,Unknown,Unknown,Unknown,Unknown,Unknown,Unknown,Unknown,Unknown,9:00,AM,Unknown,Unknown,Unknown,Calif.,Unknown,Glendale,Brazil Street,Public,A,sedan,Unknown,Unknown,Unknown,1,Northbound,3,Moving over crossing,Unknown,Metrolink train,Unknown,Unknown,1,Train struck car,4,Unknown,4,Unknown,Unknown,Unknown,Unknown,2,Day,Unknown,Unknown,Unknown,Commuter Train,1,Main,Unknown,Unknown,Unknown,Unknown,Unknown,Unknown,Unknown,2,Southbound,Unknown,Unknown,Unknown,Unknown,Unknown,Unknown,Unknown,Unknown,Unknown,Unknown,Unknown,Unknown,Unknown,2,Female,2,No,Unknown,Unknown,Unknown,3,Unknown,Unknown,Unknown,Unknown,1,Killed,1,Yes,1,0,Unknown,1,0,0,Unknown,1,Yes,0,0,No,No,Unknown,"A pregnant woman died after her sedan was struck by a Metrolink train in Glendale when she attempted to make a right turn at a crossing. The violent collision injured a male pedestrian with debris, stopped the train for hours, and caused significant service disruptions for other Metrolink lines.",Unknown,Unknown,Unknown
